Frame 636: 74 bytes on wire (592 bits), 74 bytes captured (592 bits)
    Arrival Time: Dec 11, 2013 09:45:59.396571000 PST
    Epoch Time: 1386783959.396571000 seconds
    [Time delta from previous captured frame: 0.038992000 seconds]
    [Time delta from previous displayed frame: 0.000000000 seconds]
    [Time since reference or first frame: 49.147772000 seconds]
    Frame Number: 636
    Frame Length: 74 bytes (592 bits)
    Capture Length: 74 bytes (592 bits)
    [Frame is marked: False]
    [Frame is ignored: False]
    [Protocols in frame: eth:ip:tcp:of]
    [Coloring Rule Name: of]
    [Coloring Rule String: of]
Ethernet II, Src: 00:00:00_00:00:00 (00:00:00:00:00:00), Dst: 00:00:00_00:00:00 (00:00:00:00:00:00)
    Destination: 00:00:00_00:00:00 (00:00:00:00:00:00)
        Address: 00:00:00_00:00:00 (00:00:00:00:00:00)
        .... ...0 .... .... .... .... = IG bit: Individual address (unicast)
        .... ..0. .... .... .... .... = LG bit: Globally unique address (factory default)
    Source: 00:00:00_00:00:00 (00:00:00:00:00:00)
        Address: 00:00:00_00:00:00 (00:00:00:00:00:00)
        .... ...0 .... .... .... .... = IG bit: Individual address (unicast)
        .... ..0. .... .... .... .... = LG bit: Globally unique address (factory default)
    Type: IP (0x0800)
Internet Protocol Version 4, Src: 127.0.0.1 (127.0.0.1), Dst: 127.0.0.1 (127.0.0.1)
    Version: 4
    Header length: 20 bytes
    Differentiated Services Field: 0x00 (DSCP 0x00: Default; ECN: 0x00: Not-ECT (Not ECN-Capable Transport))
        0000 00.. = Differentiated Services Codepoint: Default (0x00)
        .... ..00 = Explicit Congestion Notification: Not-ECT (Not ECN-Capable Transport) (0x00)
    Total Length: 60
    Identification: 0xb1a3 (45475)
    Flags: 0x02 (Don't Fragment)
        0... .... = Reserved bit: Not set
        .1.. .... = Don't fragment: Set
        ..0. .... = More fragments: Not set
    Fragment offset: 0
    Time to live: 64
    Protocol: TCP (6)
    Header checksum: 0x8b16 [correct]
        [Good: True]
        [Bad: False]
    Source: 127.0.0.1 (127.0.0.1)
    Destination: 127.0.0.1 (127.0.0.1)
Transmission Control Protocol, Src Port: 6633 (6633), Dst Port: 41499 (41499), Seq: 1, Ack: 2, Len: 8
    Source port: 6633 (6633)
    Destination port: 41499 (41499)
    [Stream index: 1]
    Sequence number: 1    (relative sequence number)
    [Next sequence number: 9    (relative sequence number)]
    Acknowledgement number: 2    (relative ack number)
    Header length: 32 bytes
    Flags: 0x018 (PSH, ACK)
        000. .... .... = Reserved: Not set
        ...0 .... .... = Nonce: Not set
        .... 0... .... = Congestion Window Reduced (CWR): Not set
        .... .0.. .... = ECN-Echo: Not set
        .... ..0. .... = Urgent: Not set
        .... ...1 .... = Acknowledgement: Set
        .... .... 1... = Push: Set
        .... .... .0.. = Reset: Not set
        .... .... ..0. = Syn: Not set
        .... .... ...0 = Fin: Not set
    Window size value: 512
    [Calculated window size: 32768]
    [Window size scaling factor: 64]
    Checksum: 0xfe30 [validation disabled]
        [Good Checksum: False]
        [Bad Checksum: False]
    Options: (12 bytes)
        No-Operation (NOP)
        No-Operation (NOP)
        Timestamps: TSval 40984, TSecr 40974
            Kind: Timestamp (8)
            Length: 10
            Timestamp value: 40984
            Timestamp echo reply: 40974
    [SEQ/ACK analysis]
        [Bytes in flight: 8]
    [PDU Size: 8]
OpenFlow Protocol
    Header
        Version: 0x01
        Type: Hello (SM) (0)
        Length: 8
        Transaction ID: 17

Frame 663: 74 bytes on wire (592 bits), 74 bytes captured (592 bits)
    Arrival Time: Dec 11, 2013 09:45:59.468980000 PST
    Epoch Time: 1386783959.468980000 seconds
    [Time delta from previous captured frame: 0.000065000 seconds]
    [Time delta from previous displayed frame: 0.072409000 seconds]
    [Time since reference or first frame: 49.220181000 seconds]
    Frame Number: 663
    Frame Length: 74 bytes (592 bits)
    Capture Length: 74 bytes (592 bits)
    [Frame is marked: False]
    [Frame is ignored: False]
    [Protocols in frame: eth:ip:tcp:of]
    [Coloring Rule Name: of]
    [Coloring Rule String: of]
Ethernet II, Src: 00:00:00_00:00:00 (00:00:00:00:00:00), Dst: 00:00:00_00:00:00 (00:00:00:00:00:00)
    Destination: 00:00:00_00:00:00 (00:00:00:00:00:00)
        Address: 00:00:00_00:00:00 (00:00:00:00:00:00)
        .... ...0 .... .... .... .... = IG bit: Individual address (unicast)
        .... ..0. .... .... .... .... = LG bit: Globally unique address (factory default)
    Source: 00:00:00_00:00:00 (00:00:00:00:00:00)
        Address: 00:00:00_00:00:00 (00:00:00:00:00:00)
        .... ...0 .... .... .... .... = IG bit: Individual address (unicast)
        .... ..0. .... .... .... .... = LG bit: Globally unique address (factory default)
    Type: IP (0x0800)
Internet Protocol Version 4, Src: 127.0.0.1 (127.0.0.1), Dst: 127.0.0.1 (127.0.0.1)
    Version: 4
    Header length: 20 bytes
    Differentiated Services Field: 0x00 (DSCP 0x00: Default; ECN: 0x00: Not-ECT (Not ECN-Capable Transport))
        0000 00.. = Differentiated Services Codepoint: Default (0x00)
        .... ..00 = Explicit Congestion Notification: Not-ECT (Not ECN-Capable Transport) (0x00)
    Total Length: 60
    Identification: 0x09a5 (2469)
    Flags: 0x02 (Don't Fragment)
        0... .... = Reserved bit: Not set
        .1.. .... = Don't fragment: Set
        ..0. .... = More fragments: Not set
    Fragment offset: 0
    Time to live: 64
    Protocol: TCP (6)
    Header checksum: 0x3315 [correct]
        [Good: True]
        [Bad: False]
    Source: 127.0.0.1 (127.0.0.1)
    Destination: 127.0.0.1 (127.0.0.1)
Transmission Control Protocol, Src Port: 41500 (41500), Dst Port: 6633 (6633), Seq: 1, Ack: 1, Len: 8
    Source port: 41500 (41500)
    Destination port: 6633 (6633)
    [Stream index: 2]
    Sequence number: 1    (relative sequence number)
    [Next sequence number: 9    (relative sequence number)]
    Acknowledgement number: 1    (relative ack number)
    Header length: 32 bytes
    Flags: 0x018 (PSH, ACK)
        000. .... .... = Reserved: Not set
        ...0 .... .... = Nonce: Not set
        .... 0... .... = Congestion Window Reduced (CWR): Not set
        .... .0.. .... = ECN-Echo: Not set
        .... ..0. .... = Urgent: Not set
        .... ...1 .... = Acknowledgement: Set
        .... .... 1... = Push: Set
        .... .... .0.. = Reset: Not set
        .... .... ..0. = Syn: Not set
        .... .... ...0 = Fin: Not set
    Window size value: 513
    [Calculated window size: 32832]
    [Window size scaling factor: 64]
    Checksum: 0xfe30 [validation disabled]
        [Good Checksum: False]
        [Bad Checksum: False]
    Options: (12 bytes)
        No-Operation (NOP)
        No-Operation (NOP)
        Timestamps: TSval 41002, TSecr 41002
            Kind: Timestamp (8)
            Length: 10
            Timestamp value: 41002
            Timestamp echo reply: 41002
    [SEQ/ACK analysis]
        [Bytes in flight: 8]
    [PDU Size: 8]
OpenFlow Protocol
    Header
        Version: 0x01
        Type: Hello (SM) (0)
        Length: 8
        Transaction ID: 2

Frame 665: 74 bytes on wire (592 bits), 74 bytes captured (592 bits)
    Arrival Time: Dec 11, 2013 09:45:59.512224000 PST
    Epoch Time: 1386783959.512224000 seconds
    [Time delta from previous captured frame: 0.043237000 seconds]
    [Time delta from previous displayed frame: 0.043244000 seconds]
    [Time since reference or first frame: 49.263425000 seconds]
    Frame Number: 665
    Frame Length: 74 bytes (592 bits)
    Capture Length: 74 bytes (592 bits)
    [Frame is marked: False]
    [Frame is ignored: False]
    [Protocols in frame: eth:ip:tcp:of]
    [Coloring Rule Name: of]
    [Coloring Rule String: of]
Ethernet II, Src: 00:00:00_00:00:00 (00:00:00:00:00:00), Dst: 00:00:00_00:00:00 (00:00:00:00:00:00)
    Destination: 00:00:00_00:00:00 (00:00:00:00:00:00)
        Address: 00:00:00_00:00:00 (00:00:00:00:00:00)
        .... ...0 .... .... .... .... = IG bit: Individual address (unicast)
        .... ..0. .... .... .... .... = LG bit: Globally unique address (factory default)
    Source: 00:00:00_00:00:00 (00:00:00:00:00:00)
        Address: 00:00:00_00:00:00 (00:00:00:00:00:00)
        .... ...0 .... .... .... .... = IG bit: Individual address (unicast)
        .... ..0. .... .... .... .... = LG bit: Globally unique address (factory default)
    Type: IP (0x0800)
Internet Protocol Version 4, Src: 127.0.0.1 (127.0.0.1), Dst: 127.0.0.1 (127.0.0.1)
    Version: 4
    Header length: 20 bytes
    Differentiated Services Field: 0x00 (DSCP 0x00: Default; ECN: 0x00: Not-ECT (Not ECN-Capable Transport))
        0000 00.. = Differentiated Services Codepoint: Default (0x00)
        .... ..00 = Explicit Congestion Notification: Not-ECT (Not ECN-Capable Transport) (0x00)
    Total Length: 60
    Identification: 0x86a9 (34473)
    Flags: 0x02 (Don't Fragment)
        0... .... = Reserved bit: Not set
        .1.. .... = Don't fragment: Set
        ..0. .... = More fragments: Not set
    Fragment offset: 0
    Time to live: 64
    Protocol: TCP (6)
    Header checksum: 0xb610 [correct]
        [Good: True]
        [Bad: False]
    Source: 127.0.0.1 (127.0.0.1)
    Destination: 127.0.0.1 (127.0.0.1)
Transmission Control Protocol, Src Port: 6633 (6633), Dst Port: 41500 (41500), Seq: 1, Ack: 9, Len: 8
    Source port: 6633 (6633)
    Destination port: 41500 (41500)
    [Stream index: 2]
    Sequence number: 1    (relative sequence number)
    [Next sequence number: 9    (relative sequence number)]
    Acknowledgement number: 9    (relative ack number)
    Header length: 32 bytes
    Flags: 0x018 (PSH, ACK)
        000. .... .... = Reserved: Not set
        ...0 .... .... = Nonce: Not set
        .... 0... .... = Congestion Window Reduced (CWR): Not set
        .... .0.. .... = ECN-Echo: Not set
        .... ..0. .... = Urgent: Not set
        .... ...1 .... = Acknowledgement: Set
        .... .... 1... = Push: Set
        .... .... .0.. = Reset: Not set
        .... .... ..0. = Syn: Not set
        .... .... ...0 = Fin: Not set
    Window size value: 512
    [Calculated window size: 32768]
    [Window size scaling factor: 64]
    Checksum: 0xfe30 [validation disabled]
        [Good Checksum: False]
        [Bad Checksum: False]
    Options: (12 bytes)
        No-Operation (NOP)
        No-Operation (NOP)
        Timestamps: TSval 41013, TSecr 41002
            Kind: Timestamp (8)
            Length: 10
            Timestamp value: 41013
            Timestamp echo reply: 41002
    [SEQ/ACK analysis]
        [Bytes in flight: 8]
    [PDU Size: 8]
OpenFlow Protocol
    Header
        Version: 0x01
        Type: Hello (SM) (0)
        Length: 8
        Transaction ID: 18

Frame 667: 74 bytes on wire (592 bits), 74 bytes captured (592 bits)
    Arrival Time: Dec 11, 2013 09:45:59.512469000 PST
    Epoch Time: 1386783959.512469000 seconds
    [Time delta from previous captured frame: 0.000206000 seconds]
    [Time delta from previous displayed frame: 0.000245000 seconds]
    [Time since reference or first frame: 49.263670000 seconds]
    Frame Number: 667
    Frame Length: 74 bytes (592 bits)
    Capture Length: 74 bytes (592 bits)
    [Frame is marked: False]
    [Frame is ignored: False]
    [Protocols in frame: eth:ip:tcp:of]
    [Coloring Rule Name: of]
    [Coloring Rule String: of]
Ethernet II, Src: 00:00:00_00:00:00 (00:00:00:00:00:00), Dst: 00:00:00_00:00:00 (00:00:00:00:00:00)
    Destination: 00:00:00_00:00:00 (00:00:00:00:00:00)
        Address: 00:00:00_00:00:00 (00:00:00:00:00:00)
        .... ...0 .... .... .... .... = IG bit: Individual address (unicast)
        .... ..0. .... .... .... .... = LG bit: Globally unique address (factory default)
    Source: 00:00:00_00:00:00 (00:00:00:00:00:00)
        Address: 00:00:00_00:00:00 (00:00:00:00:00:00)
        .... ...0 .... .... .... .... = IG bit: Individual address (unicast)
        .... ..0. .... .... .... .... = LG bit: Globally unique address (factory default)
    Type: IP (0x0800)
Internet Protocol Version 4, Src: 127.0.0.1 (127.0.0.1), Dst: 127.0.0.1 (127.0.0.1)
    Version: 4
    Header length: 20 bytes
    Differentiated Services Field: 0x00 (DSCP 0x00: Default; ECN: 0x00: Not-ECT (Not ECN-Capable Transport))
        0000 00.. = Differentiated Services Codepoint: Default (0x00)
        .... ..00 = Explicit Congestion Notification: Not-ECT (Not ECN-Capable Transport) (0x00)
    Total Length: 60
    Identification: 0x86aa (34474)
    Flags: 0x02 (Don't Fragment)
        0... .... = Reserved bit: Not set
        .1.. .... = Don't fragment: Set
        ..0. .... = More fragments: Not set
    Fragment offset: 0
    Time to live: 64
    Protocol: TCP (6)
    Header checksum: 0xb60f [correct]
        [Good: True]
        [Bad: False]
    Source: 127.0.0.1 (127.0.0.1)
    Destination: 127.0.0.1 (127.0.0.1)
Transmission Control Protocol, Src Port: 6633 (6633), Dst Port: 41500 (41500), Seq: 9, Ack: 9, Len: 8
    Source port: 6633 (6633)
    Destination port: 41500 (41500)
    [Stream index: 2]
    Sequence number: 9    (relative sequence number)
    [Next sequence number: 17    (relative sequence number)]
    Acknowledgement number: 9    (relative ack number)
    Header length: 32 bytes
    Flags: 0x018 (PSH, ACK)
        000. .... .... = Reserved: Not set
        ...0 .... .... = Nonce: Not set
        .... 0... .... = Congestion Window Reduced (CWR): Not set
        .... .0.. .... = ECN-Echo: Not set
        .... ..0. .... = Urgent: Not set
        .... ...1 .... = Acknowledgement: Set
        .... .... 1... = Push: Set
        .... .... .0.. = Reset: Not set
        .... .... ..0. = Syn: Not set
        .... .... ...0 = Fin: Not set
    Window size value: 512
    [Calculated window size: 32768]
    [Window size scaling factor: 64]
    Checksum: 0xfe30 [validation disabled]
        [Good Checksum: False]
        [Bad Checksum: False]
    Options: (12 bytes)
        No-Operation (NOP)
        No-Operation (NOP)
        Timestamps: TSval 41013, TSecr 41013
            Kind: Timestamp (8)
            Length: 10
            Timestamp value: 41013
            Timestamp echo reply: 41013
    [SEQ/ACK analysis]
        [Bytes in flight: 8]
    [PDU Size: 8]
OpenFlow Protocol
    Header
        Version: 0x01
        Type: Features Request (CSM) (5)
        Length: 8
        Transaction ID: 19

Frame 669: 242 bytes on wire (1936 bits), 242 bytes captured (1936 bits)
    Arrival Time: Dec 11, 2013 09:45:59.512806000 PST
    Epoch Time: 1386783959.512806000 seconds
    [Time delta from previous captured frame: 0.000314000 seconds]
    [Time delta from previous displayed frame: 0.000337000 seconds]
    [Time since reference or first frame: 49.264007000 seconds]
    Frame Number: 669
    Frame Length: 242 bytes (1936 bits)
    Capture Length: 242 bytes (1936 bits)
    [Frame is marked: False]
    [Frame is ignored: False]
    [Protocols in frame: eth:ip:tcp:of]
    [Coloring Rule Name: of]
    [Coloring Rule String: of]
Ethernet II, Src: 00:00:00_00:00:00 (00:00:00:00:00:00), Dst: 00:00:00_00:00:00 (00:00:00:00:00:00)
    Destination: 00:00:00_00:00:00 (00:00:00:00:00:00)
        Address: 00:00:00_00:00:00 (00:00:00:00:00:00)
        .... ...0 .... .... .... .... = IG bit: Individual address (unicast)
        .... ..0. .... .... .... .... = LG bit: Globally unique address (factory default)
    Source: 00:00:00_00:00:00 (00:00:00:00:00:00)
        Address: 00:00:00_00:00:00 (00:00:00:00:00:00)
        .... ...0 .... .... .... .... = IG bit: Individual address (unicast)
        .... ..0. .... .... .... .... = LG bit: Globally unique address (factory default)
    Type: IP (0x0800)
Internet Protocol Version 4, Src: 127.0.0.1 (127.0.0.1), Dst: 127.0.0.1 (127.0.0.1)
    Version: 4
    Header length: 20 bytes
    Differentiated Services Field: 0x00 (DSCP 0x00: Default; ECN: 0x00: Not-ECT (Not ECN-Capable Transport))
        0000 00.. = Differentiated Services Codepoint: Default (0x00)
        .... ..00 = Explicit Congestion Notification: Not-ECT (Not ECN-Capable Transport) (0x00)
    Total Length: 228
    Identification: 0x09a8 (2472)
    Flags: 0x02 (Don't Fragment)
        0... .... = Reserved bit: Not set
        .1.. .... = Don't fragment: Set
        ..0. .... = More fragments: Not set
    Fragment offset: 0
    Time to live: 64
    Protocol: TCP (6)
    Header checksum: 0x326a [correct]
        [Good: True]
        [Bad: False]
    Source: 127.0.0.1 (127.0.0.1)
    Destination: 127.0.0.1 (127.0.0.1)
Transmission Control Protocol, Src Port: 41500 (41500), Dst Port: 6633 (6633), Seq: 9, Ack: 17, Len: 176
    Source port: 41500 (41500)
    Destination port: 6633 (6633)
    [Stream index: 2]
    Sequence number: 9    (relative sequence number)
    [Next sequence number: 185    (relative sequence number)]
    Acknowledgement number: 17    (relative ack number)
    Header length: 32 bytes
    Flags: 0x018 (PSH, ACK)
        000. .... .... = Reserved: Not set
        ...0 .... .... = Nonce: Not set
        .... 0... .... = Congestion Window Reduced (CWR): Not set
        .... .0.. .... = ECN-Echo: Not set
        .... ..0. .... = Urgent: Not set
        .... ...1 .... = Acknowledgement: Set
        .... .... 1... = Push: Set
        .... .... .0.. = Reset: Not set
        .... .... ..0. = Syn: Not set
        .... .... ...0 = Fin: Not set
    Window size value: 513
    [Calculated window size: 32832]
    [Window size scaling factor: 64]
    Checksum: 0xfed8 [validation disabled]
        [Good Checksum: False]
        [Bad Checksum: False]
    Options: (12 bytes)
        No-Operation (NOP)
        No-Operation (NOP)
        Timestamps: TSval 41013, TSecr 41013
            Kind: Timestamp (8)
            Length: 10
            Timestamp value: 41013
            Timestamp echo reply: 41013
    [SEQ/ACK analysis]
        [Bytes in flight: 176]
    [PDU Size: 176]
OpenFlow Protocol
    Header
        Version: 0x01
        Type: Features Reply (CSM) (6)
        Length: 176
        Transaction ID: 19
    Switch Features
        Datapath ID: 0x0000000000000001
        Max packets buffered: 256
        Number of Tables: 255
        Capabilities: 0x000000c7
            .... .... .... .... .... .... .... ...1 =   Flow statistics: Yes (1)
            .... .... .... .... .... .... .... ..1. =   Table statistics: Yes (1)
            .... .... .... .... .... .... .... .1.. =   Port statistics: Yes (1)
            .... .... .... .... .... .... .... 0... =   802.11d spanning tree: No (0)
            .... .... .... .... .... .... ...0 .... =   Reserved: No (0)
            .... .... .... .... .... .... ..0. .... =   Can reassemble IP fragments: No (0)
            .... .... .... .... .... .... .1.. .... =   Queue statistics: Yes (1)
            .... .... .... .... .... .... 1... .... =   Match IP addresses in ARP pkts: Yes (1)
        Actions: 0x00000fff
            .... .... .... .... .... .... .... ...1 =   Output to switch port: Yes (1)
            .... .... .... .... .... .... .... ..1. =   Set the 802.1q VLAN id: Yes (1)
            .... .... .... .... .... .... .... .1.. =   Set the 802.1q priority: Yes (1)
            .... .... .... .... .... .... .... 1... =   Strip the 802.1q header: Yes (1)
            .... .... .... .... .... .... ...1 .... =   Ethernet source address: Yes (1)
            .... .... .... .... .... .... ..1. .... =   Ethernet destination address: Yes (1)
            .... .... .... .... .... .... .1.. .... =   IP source address: Yes (1)
            .... .... .... .... .... .... 1... .... =   IP destination address: Yes (1)
            .... .... .... .... .... ...1 .... .... =   Set IP TOS bits: Yes (1)
            .... .... .... .... .... ..1. .... .... =   TCP/UDP source: Yes (1)
            .... .... .... .... .... .1.. .... .... =   TCP/UDP destination: Yes (1)
            .... .... .... .... .... 1... .... .... =   Enqueue port queue: Yes (1)
        Port Definitions
            # of Ports: 3
            Physical Port
                Port #: 2
                MAC Address: ae:20:82:54:0a:8c (ae:20:82:54:0a:8c)
                Port Name: s1-eth2
                Port Config Flags
                    .... .... .... .... .... .... .... ...0 =   Port is administratively down: No (0)
                    .... .... .... .... .... .... .... ..0. =   Disable 802.1D spanning tree on port: No (0)
                    .... .... .... .... .... .... .... .0.. =   Drop non-802.1D packets received on port: No (0)
                    .... .... .... .... .... .... .... 0... =   Drop received 802.1D STP packets: No (0)
                    .... .... .... .... .... .... ...0 .... =   Do not include this port when flooding: No (0)
                    .... .... .... .... .... .... ..0. .... =   Drop packets forwarded to port: No (0)
                    .... .... .... .... .... .... .0.. .... =   Do not send packet-in msgs for port: No (0)
                Port State Flags
                    STP state: Not learning or relaying frames
                Port Current Flags
                    .... .... .... .... .... .... .... ...0 =    10 Mb half-duplex rate support: No (0)
                    .... .... .... .... .... .... .... ..0. =    10 Mb full-duplex rate support: No (0)
                    .... .... .... .... .... .... .... .0.. =   100 Mb half-duplex rate support: No (0)
                    .... .... .... .... .... .... .... 0... =   100 Mb full-duplex rate support: No (0)
                    .... .... .... .... .... .... ...0 .... =     1 Gb half-duplex rate support: No (0)
                    .... .... .... .... .... .... ..0. .... =     1 Gb full-duplex rate support: No (0)
                    .... .... .... .... .... .... .1.. .... =    10 Gb full-duplex rate support: Yes (1)
                    .... .... .... .... .... .... 1... .... =    Copper medium support: Yes (1)
                    .... .... .... .... .... ...0 .... .... =    Fiber medium support: No (0)
                    .... .... .... .... .... ..0. .... .... =    Auto-negotiation support: No (0)
                    .... .... .... .... .... .0.. .... .... =    Pause support: No (0)
                    .... .... .... .... .... 0... .... .... =    Asymmetric pause support: No (0)
                Port Advertsied Flags
                    .... .... .... .... .... .... .... ...0 =    10 Mb half-duplex rate support: No (0)
                    .... .... .... .... .... .... .... ..0. =    10 Mb full-duplex rate support: No (0)
                    .... .... .... .... .... .... .... .0.. =   100 Mb half-duplex rate support: No (0)
                    .... .... .... .... .... .... .... 0... =   100 Mb full-duplex rate support: No (0)
                    .... .... .... .... .... .... ...0 .... =     1 Gb half-duplex rate support: No (0)
                    .... .... .... .... .... .... ..0. .... =     1 Gb full-duplex rate support: No (0)
                    .... .... .... .... .... .... .0.. .... =    10 Gb full-duplex rate support: No (0)
                    .... .... .... .... .... .... 0... .... =    Copper medium support: No (0)
                    .... .... .... .... .... ...0 .... .... =    Fiber medium support: No (0)
                    .... .... .... .... .... ..0. .... .... =    Auto-negotiation support: No (0)
                    .... .... .... .... .... .0.. .... .... =    Pause support: No (0)
                    .... .... .... .... .... 0... .... .... =    Asymmetric pause support: No (0)
                Port Supported Flags
                    .... .... .... .... .... .... .... ...0 =    10 Mb half-duplex rate support: No (0)
                    .... .... .... .... .... .... .... ..0. =    10 Mb full-duplex rate support: No (0)
                    .... .... .... .... .... .... .... .0.. =   100 Mb half-duplex rate support: No (0)
                    .... .... .... .... .... .... .... 0... =   100 Mb full-duplex rate support: No (0)
                    .... .... .... .... .... .... ...0 .... =     1 Gb half-duplex rate support: No (0)
                    .... .... .... .... .... .... ..0. .... =     1 Gb full-duplex rate support: No (0)
                    .... .... .... .... .... .... .0.. .... =    10 Gb full-duplex rate support: No (0)
                    .... .... .... .... .... .... 0... .... =    Copper medium support: No (0)
                    .... .... .... .... .... ...0 .... .... =    Fiber medium support: No (0)
                    .... .... .... .... .... ..0. .... .... =    Auto-negotiation support: No (0)
                    .... .... .... .... .... .0.. .... .... =    Pause support: No (0)
                    .... .... .... .... .... 0... .... .... =    Asymmetric pause support: No (0)
                Port Peer Flags
                    .... .... .... .... .... .... .... ...0 =    10 Mb half-duplex rate support: No (0)
                    .... .... .... .... .... .... .... ..0. =    10 Mb full-duplex rate support: No (0)
                    .... .... .... .... .... .... .... .0.. =   100 Mb half-duplex rate support: No (0)
                    .... .... .... .... .... .... .... 0... =   100 Mb full-duplex rate support: No (0)
                    .... .... .... .... .... .... ...0 .... =     1 Gb half-duplex rate support: No (0)
                    .... .... .... .... .... .... ..0. .... =     1 Gb full-duplex rate support: No (0)
                    .... .... .... .... .... .... .0.. .... =    10 Gb full-duplex rate support: No (0)
                    .... .... .... .... .... .... 0... .... =    Copper medium support: No (0)
                    .... .... .... .... .... ...0 .... .... =    Fiber medium support: No (0)
                    .... .... .... .... .... ..0. .... .... =    Auto-negotiation support: No (0)
                    .... .... .... .... .... .0.. .... .... =    Pause support: No (0)
                    .... .... .... .... .... 0... .... .... =    Asymmetric pause support: No (0)
            Physical Port
                Port #: Local  (local openflow "port")
                MAC Address: 2e:f2:ce:76:47:48 (2e:f2:ce:76:47:48)
                Port Name: s1
                Port Config Flags
                    .... .... .... .... .... .... .... ...1 =   Port is administratively down: Yes (1)
                    .... .... .... .... .... .... .... ..0. =   Disable 802.1D spanning tree on port: No (0)
                    .... .... .... .... .... .... .... .0.. =   Drop non-802.1D packets received on port: No (0)
                    .... .... .... .... .... .... .... 0... =   Drop received 802.1D STP packets: No (0)
                    .... .... .... .... .... .... ...0 .... =   Do not include this port when flooding: No (0)
                    .... .... .... .... .... .... ..0. .... =   Drop packets forwarded to port: No (0)
                    .... .... .... .... .... .... .0.. .... =   Do not send packet-in msgs for port: No (0)
                Port State Flags
                    .... .... .... .... .... .... .... ...1 =   No physical link present: 1
                    STP state: Not learning or relaying frames
                Port Current Flags
                    .... .... .... .... .... .... .... ...0 =    10 Mb half-duplex rate support: No (0)
                    .... .... .... .... .... .... .... ..0. =    10 Mb full-duplex rate support: No (0)
                    .... .... .... .... .... .... .... .0.. =   100 Mb half-duplex rate support: No (0)
                    .... .... .... .... .... .... .... 0... =   100 Mb full-duplex rate support: No (0)
                    .... .... .... .... .... .... ...0 .... =     1 Gb half-duplex rate support: No (0)
                    .... .... .... .... .... .... ..0. .... =     1 Gb full-duplex rate support: No (0)
                    .... .... .... .... .... .... .0.. .... =    10 Gb full-duplex rate support: No (0)
                    .... .... .... .... .... .... 0... .... =    Copper medium support: No (0)
                    .... .... .... .... .... ...0 .... .... =    Fiber medium support: No (0)
                    .... .... .... .... .... ..0. .... .... =    Auto-negotiation support: No (0)
                    .... .... .... .... .... .0.. .... .... =    Pause support: No (0)
                    .... .... .... .... .... 0... .... .... =    Asymmetric pause support: No (0)
                Port Advertsied Flags
                    .... .... .... .... .... .... .... ...0 =    10 Mb half-duplex rate support: No (0)
                    .... .... .... .... .... .... .... ..0. =    10 Mb full-duplex rate support: No (0)
                    .... .... .... .... .... .... .... .0.. =   100 Mb half-duplex rate support: No (0)
                    .... .... .... .... .... .... .... 0... =   100 Mb full-duplex rate support: No (0)
                    .... .... .... .... .... .... ...0 .... =     1 Gb half-duplex rate support: No (0)
                    .... .... .... .... .... .... ..0. .... =     1 Gb full-duplex rate support: No (0)
                    .... .... .... .... .... .... .0.. .... =    10 Gb full-duplex rate support: No (0)
                    .... .... .... .... .... .... 0... .... =    Copper medium support: No (0)
                    .... .... .... .... .... ...0 .... .... =    Fiber medium support: No (0)
                    .... .... .... .... .... ..0. .... .... =    Auto-negotiation support: No (0)
                    .... .... .... .... .... .0.. .... .... =    Pause support: No (0)
                    .... .... .... .... .... 0... .... .... =    Asymmetric pause support: No (0)
                Port Supported Flags
                    .... .... .... .... .... .... .... ...0 =    10 Mb half-duplex rate support: No (0)
                    .... .... .... .... .... .... .... ..0. =    10 Mb full-duplex rate support: No (0)
                    .... .... .... .... .... .... .... .0.. =   100 Mb half-duplex rate support: No (0)
                    .... .... .... .... .... .... .... 0... =   100 Mb full-duplex rate support: No (0)
                    .... .... .... .... .... .... ...0 .... =     1 Gb half-duplex rate support: No (0)
                    .... .... .... .... .... .... ..0. .... =     1 Gb full-duplex rate support: No (0)
                    .... .... .... .... .... .... .0.. .... =    10 Gb full-duplex rate support: No (0)
                    .... .... .... .... .... .... 0... .... =    Copper medium support: No (0)
                    .... .... .... .... .... ...0 .... .... =    Fiber medium support: No (0)
                    .... .... .... .... .... ..0. .... .... =    Auto-negotiation support: No (0)
                    .... .... .... .... .... .0.. .... .... =    Pause support: No (0)
                    .... .... .... .... .... 0... .... .... =    Asymmetric pause support: No (0)
                Port Peer Flags
                    .... .... .... .... .... .... .... ...0 =    10 Mb half-duplex rate support: No (0)
                    .... .... .... .... .... .... .... ..0. =    10 Mb full-duplex rate support: No (0)
                    .... .... .... .... .... .... .... .0.. =   100 Mb half-duplex rate support: No (0)
                    .... .... .... .... .... .... .... 0... =   100 Mb full-duplex rate support: No (0)
                    .... .... .... .... .... .... ...0 .... =     1 Gb half-duplex rate support: No (0)
                    .... .... .... .... .... .... ..0. .... =     1 Gb full-duplex rate support: No (0)
                    .... .... .... .... .... .... .0.. .... =    10 Gb full-duplex rate support: No (0)
                    .... .... .... .... .... .... 0... .... =    Copper medium support: No (0)
                    .... .... .... .... .... ...0 .... .... =    Fiber medium support: No (0)
                    .... .... .... .... .... ..0. .... .... =    Auto-negotiation support: No (0)
                    .... .... .... .... .... .0.. .... .... =    Pause support: No (0)
                    .... .... .... .... .... 0... .... .... =    Asymmetric pause support: No (0)
            Physical Port
                Port #: 1
                MAC Address: 6e:2f:90:06:b5:bb (6e:2f:90:06:b5:bb)
                Port Name: s1-eth1
                Port Config Flags
                    .... .... .... .... .... .... .... ...0 =   Port is administratively down: No (0)
                    .... .... .... .... .... .... .... ..0. =   Disable 802.1D spanning tree on port: No (0)
                    .... .... .... .... .... .... .... .0.. =   Drop non-802.1D packets received on port: No (0)
                    .... .... .... .... .... .... .... 0... =   Drop received 802.1D STP packets: No (0)
                    .... .... .... .... .... .... ...0 .... =   Do not include this port when flooding: No (0)
                    .... .... .... .... .... .... ..0. .... =   Drop packets forwarded to port: No (0)
                    .... .... .... .... .... .... .0.. .... =   Do not send packet-in msgs for port: No (0)
                Port State Flags
                    .... .... .... .... .... .... .... ...1 =   No physical link present: 1
                    STP state: Not learning or relaying frames
                Port Current Flags
                    .... .... .... .... .... .... .... ...0 =    10 Mb half-duplex rate support: No (0)
                    .... .... .... .... .... .... .... ..0. =    10 Mb full-duplex rate support: No (0)
                    .... .... .... .... .... .... .... .0.. =   100 Mb half-duplex rate support: No (0)
                    .... .... .... .... .... .... .... 0... =   100 Mb full-duplex rate support: No (0)
                    .... .... .... .... .... .... ...0 .... =     1 Gb half-duplex rate support: No (0)
                    .... .... .... .... .... .... ..0. .... =     1 Gb full-duplex rate support: No (0)
                    .... .... .... .... .... .... .1.. .... =    10 Gb full-duplex rate support: Yes (1)
                    .... .... .... .... .... .... 1... .... =    Copper medium support: Yes (1)
                    .... .... .... .... .... ...0 .... .... =    Fiber medium support: No (0)
                    .... .... .... .... .... ..0. .... .... =    Auto-negotiation support: No (0)
                    .... .... .... .... .... .0.. .... .... =    Pause support: No (0)
                    .... .... .... .... .... 0... .... .... =    Asymmetric pause support: No (0)
                Port Advertsied Flags
                    .... .... .... .... .... .... .... ...0 =    10 Mb half-duplex rate support: No (0)
                    .... .... .... .... .... .... .... ..0. =    10 Mb full-duplex rate support: No (0)
                    .... .... .... .... .... .... .... .0.. =   100 Mb half-duplex rate support: No (0)
                    .... .... .... .... .... .... .... 0... =   100 Mb full-duplex rate support: No (0)
                    .... .... .... .... .... .... ...0 .... =     1 Gb half-duplex rate support: No (0)
                    .... .... .... .... .... .... ..0. .... =     1 Gb full-duplex rate support: No (0)
                    .... .... .... .... .... .... .0.. .... =    10 Gb full-duplex rate support: No (0)
                    .... .... .... .... .... .... 0... .... =    Copper medium support: No (0)
                    .... .... .... .... .... ...0 .... .... =    Fiber medium support: No (0)
                    .... .... .... .... .... ..0. .... .... =    Auto-negotiation support: No (0)
                    .... .... .... .... .... .0.. .... .... =    Pause support: No (0)
                    .... .... .... .... .... 0... .... .... =    Asymmetric pause support: No (0)
                Port Supported Flags
                    .... .... .... .... .... .... .... ...0 =    10 Mb half-duplex rate support: No (0)
                    .... .... .... .... .... .... .... ..0. =    10 Mb full-duplex rate support: No (0)
                    .... .... .... .... .... .... .... .0.. =   100 Mb half-duplex rate support: No (0)
                    .... .... .... .... .... .... .... 0... =   100 Mb full-duplex rate support: No (0)
                    .... .... .... .... .... .... ...0 .... =     1 Gb half-duplex rate support: No (0)
                    .... .... .... .... .... .... ..0. .... =     1 Gb full-duplex rate support: No (0)
                    .... .... .... .... .... .... .0.. .... =    10 Gb full-duplex rate support: No (0)
                    .... .... .... .... .... .... 0... .... =    Copper medium support: No (0)
                    .... .... .... .... .... ...0 .... .... =    Fiber medium support: No (0)
                    .... .... .... .... .... ..0. .... .... =    Auto-negotiation support: No (0)
                    .... .... .... .... .... .0.. .... .... =    Pause support: No (0)
                    .... .... .... .... .... 0... .... .... =    Asymmetric pause support: No (0)
                Port Peer Flags
                    .... .... .... .... .... .... .... ...0 =    10 Mb half-duplex rate support: No (0)
                    .... .... .... .... .... .... .... ..0. =    10 Mb full-duplex rate support: No (0)
                    .... .... .... .... .... .... .... .0.. =   100 Mb half-duplex rate support: No (0)
                    .... .... .... .... .... .... .... 0... =   100 Mb full-duplex rate support: No (0)
                    .... .... .... .... .... .... ...0 .... =     1 Gb half-duplex rate support: No (0)
                    .... .... .... .... .... .... ..0. .... =     1 Gb full-duplex rate support: No (0)
                    .... .... .... .... .... .... .0.. .... =    10 Gb full-duplex rate support: No (0)
                    .... .... .... .... .... .... 0... .... =    Copper medium support: No (0)
                    .... .... .... .... .... ...0 .... .... =    Fiber medium support: No (0)
                    .... .... .... .... .... ..0. .... .... =    Auto-negotiation support: No (0)
                    .... .... .... .... .... .0.. .... .... =    Pause support: No (0)
                    .... .... .... .... .... 0... .... .... =    Asymmetric pause support: No (0)

Frame 671: 78 bytes on wire (624 bits), 78 bytes captured (624 bits)
    Arrival Time: Dec 11, 2013 09:45:59.514999000 PST
    Epoch Time: 1386783959.514999000 seconds
    [Time delta from previous captured frame: 0.002182000 seconds]
    [Time delta from previous displayed frame: 0.002193000 seconds]
    [Time since reference or first frame: 49.266200000 seconds]
    Frame Number: 671
    Frame Length: 78 bytes (624 bits)
    Capture Length: 78 bytes (624 bits)
    [Frame is marked: False]
    [Frame is ignored: False]
    [Protocols in frame: eth:ip:tcp:of]
    [Coloring Rule Name: of]
    [Coloring Rule String: of]
Ethernet II, Src: 00:00:00_00:00:00 (00:00:00:00:00:00), Dst: 00:00:00_00:00:00 (00:00:00:00:00:00)
    Destination: 00:00:00_00:00:00 (00:00:00:00:00:00)
        Address: 00:00:00_00:00:00 (00:00:00:00:00:00)
        .... ...0 .... .... .... .... = IG bit: Individual address (unicast)
        .... ..0. .... .... .... .... = LG bit: Globally unique address (factory default)
    Source: 00:00:00_00:00:00 (00:00:00:00:00:00)
        Address: 00:00:00_00:00:00 (00:00:00:00:00:00)
        .... ...0 .... .... .... .... = IG bit: Individual address (unicast)
        .... ..0. .... .... .... .... = LG bit: Globally unique address (factory default)
    Type: IP (0x0800)
Internet Protocol Version 4, Src: 127.0.0.1 (127.0.0.1), Dst: 127.0.0.1 (127.0.0.1)
    Version: 4
    Header length: 20 bytes
    Differentiated Services Field: 0x00 (DSCP 0x00: Default; ECN: 0x00: Not-ECT (Not ECN-Capable Transport))
        0000 00.. = Differentiated Services Codepoint: Default (0x00)
        .... ..00 = Explicit Congestion Notification: Not-ECT (Not ECN-Capable Transport) (0x00)
