<?xml version="1.0"?>
<?xml-stylesheet type="text/xsl" href="pdml2html.xsl"?>
<!-- You can find pdml2html.xsl in /usr/share/wireshark or at http://anonsvn.wireshark.org/trunk/wireshark/pdml2html.xsl. -->
<pdml version="0" creator="wireshark/1.6.7" time="Wed Dec 11 10:00:23 2013" capture_file="/tmp/wireshark_lo_20131211094510_6rxdhf">
<packet>
  <proto name="geninfo" pos="0" showname="General information" size="74">
    <field name="num" pos="0" show="636" showname="Number" value="27c" size="74"/>
    <field name="len" pos="0" show="74" showname="Frame Length" value="4a" size="74"/>
    <field name="caplen" pos="0" show="74" showname="Captured Length" value="4a" size="74"/>
    <field name="timestamp" pos="0" show="Dec 11, 2013 09:45:59.396571000 PST" showname="Captured Time" value="1386783959.396571000" size="74"/>
  </proto>
  <proto name="frame" showname="Frame 636: 74 bytes on wire (592 bits), 74 bytes captured (592 bits)" size="74" pos="0">
    <field name="frame.time" showname="Arrival Time: Dec 11, 2013 09:45:59.396571000 PST" size="0" pos="0" show="Dec 11, 2013 09:45:59.396571000"/>
    <field name="frame.time_epoch" showname="Epoch Time: 1386783959.396571000 seconds" size="0" pos="0" show="1386783959.396571000"/>
    <field name="frame.time_delta" showname="Time delta from previous captured frame: 0.038992000 seconds" size="0" pos="0" show="0.038992000"/>
    <field name="frame.time_delta_displayed" showname="Time delta from previous displayed frame: 0.000000000 seconds" size="0" pos="0" show="0.000000000"/>
    <field name="frame.time_relative" showname="Time since reference or first frame: 49.147772000 seconds" size="0" pos="0" show="49.147772000"/>
    <field name="frame.number" showname="Frame Number: 636" size="0" pos="0" show="636"/>
    <field name="frame.len" showname="Frame Length: 74 bytes (592 bits)" size="0" pos="0" show="74"/>
    <field name="frame.cap_len" showname="Capture Length: 74 bytes (592 bits)" size="0" pos="0" show="74"/>
    <field name="frame.marked" showname="Frame is marked: False" size="0" pos="0" show="0"/>
    <field name="frame.ignored" showname="Frame is ignored: False" size="0" pos="0" show="0"/>
    <field name="frame.protocols" showname="Protocols in frame: eth:ip:tcp:of" size="0" pos="0" show="eth:ip:tcp:of"/>
    <field name="frame.coloring_rule.name" showname="Coloring Rule Name: of" size="0" pos="0" show="of"/>
    <field name="frame.coloring_rule.string" showname="Coloring Rule String: of" size="0" pos="0" show="of"/>
  </proto>
  <proto name="eth" showname="Ethernet II, Src: 00:00:00_00:00:00 (00:00:00:00:00:00), Dst: 00:00:00_00:00:00 (00:00:00:00:00:00)" size="14" pos="0">
    <field name="eth.dst" showname="Destination: 00:00:00_00:00:00 (00:00:00:00:00:00)" size="6" pos="0" show="00:00:00:00:00:00" value="000000000000">
      <field name="eth.addr" showname="Address: 00:00:00_00:00:00 (00:00:00:00:00:00)" size="6" pos="0" show="00:00:00:00:00:00" value="000000000000"/>
      <field name="eth.ig" showname=".... ...0 .... .... .... .... = IG bit: Individual address (unicast)" size="3" pos="0" show="0" value="0" unmaskedvalue="000000"/>
      <field name="eth.lg" showname=".... ..0. .... .... .... .... = LG bit: Globally unique address (factory default)" size="3" pos="0" show="0" value="0" unmaskedvalue="000000"/>
    </field>
    <field name="eth.src" showname="Source: 00:00:00_00:00:00 (00:00:00:00:00:00)" size="6" pos="6" show="00:00:00:00:00:00" value="000000000000">
      <field name="eth.addr" showname="Address: 00:00:00_00:00:00 (00:00:00:00:00:00)" size="6" pos="6" show="00:00:00:00:00:00" value="000000000000"/>
      <field name="eth.ig" showname=".... ...0 .... .... .... .... = IG bit: Individual address (unicast)" size="3" pos="6" show="0" value="0" unmaskedvalue="000000"/>
      <field name="eth.lg" showname=".... ..0. .... .... .... .... = LG bit: Globally unique address (factory default)" size="3" pos="6" show="0" value="0" unmaskedvalue="000000"/>
    </field>
    <field name="eth.type" showname="Type: IP (0x0800)" size="2" pos="12" show="0x0800" value="0800"/>
  </proto>
  <proto name="ip" showname="Internet Protocol Version 4, Src: 127.0.0.1 (127.0.0.1), Dst: 127.0.0.1 (127.0.0.1)" size="20" pos="14">
    <field name="ip.version" showname="Version: 4" size="1" pos="14" show="4" value="45"/>
    <field name="ip.hdr_len" showname="Header length: 20 bytes" size="1" pos="14" show="20" value="45"/>
    <field name="ip.dsfield" showname="Differentiated Services Field: 0x00 (DSCP 0x00: Default; ECN: 0x00: Not-ECT (Not ECN-Capable Transport))" size="1" pos="15" show="0" value="00">
      <field name="ip.dsfield.dscp" showname="0000 00.. = Differentiated Services Codepoint: Default (0x00)" size="1" pos="15" show="0x00" value="0" unmaskedvalue="00"/>
      <field name="ip.dsfield.ecn" showname=".... ..00 = Explicit Congestion Notification: Not-ECT (Not ECN-Capable Transport) (0x00)" size="1" pos="15" show="0x00" value="0" unmaskedvalue="00"/>
    </field>
    <field name="ip.len" showname="Total Length: 60" size="2" pos="16" show="60" value="003c"/>
    <field name="ip.id" showname="Identification: 0xb1a3 (45475)" size="2" pos="18" show="0xb1a3" value="b1a3"/>
    <field name="ip.flags" showname="Flags: 0x02 (Don&apos;t Fragment)" size="1" pos="20" show="0x02" value="40">
      <field name="ip.flags.rb" showname="0... .... = Reserved bit: Not set" size="1" pos="20" show="0" value="40"/>
      <field name="ip.flags.df" showname=".1.. .... = Don&apos;t fragment: Set" size="1" pos="20" show="1" value="40"/>
      <field name="ip.flags.mf" showname="..0. .... = More fragments: Not set" size="1" pos="20" show="0" value="40"/>
    </field>
    <field name="ip.frag_offset" showname="Fragment offset: 0" size="2" pos="20" show="0" value="4000"/>
    <field name="ip.ttl" showname="Time to live: 64" size="1" pos="22" show="64" value="40"/>
    <field name="ip.proto" showname="Protocol: TCP (6)" size="1" pos="23" show="6" value="06"/>
    <field name="ip.checksum" showname="Header checksum: 0x8b16 [correct]" size="2" pos="24" show="0x8b16" value="8b16">
      <field name="ip.checksum_good" showname="Good: True" size="2" pos="24" show="1" value="8b16"/>
      <field name="ip.checksum_bad" showname="Bad: False" size="2" pos="24" show="0" value="8b16"/>
    </field>
    <field name="ip.src" showname="Source: 127.0.0.1 (127.0.0.1)" size="4" pos="26" show="127.0.0.1" value="7f000001"/>
    <field name="ip.addr" showname="Source or Destination Address: 127.0.0.1 (127.0.0.1)" hide="yes" size="4" pos="26" show="127.0.0.1" value="7f000001"/>
    <field name="ip.src_host" showname="Source Host: 127.0.0.1" hide="yes" size="4" pos="26" show="127.0.0.1" value="7f000001"/>
    <field name="ip.host" showname="Source or Destination Host: 127.0.0.1" hide="yes" size="4" pos="26" show="127.0.0.1" value="7f000001"/>
    <field name="ip.dst" showname="Destination: 127.0.0.1 (127.0.0.1)" size="4" pos="30" show="127.0.0.1" value="7f000001"/>
    <field name="ip.addr" showname="Source or Destination Address: 127.0.0.1 (127.0.0.1)" hide="yes" size="4" pos="30" show="127.0.0.1" value="7f000001"/>
    <field name="ip.dst_host" showname="Destination Host: 127.0.0.1" hide="yes" size="4" pos="30" show="127.0.0.1" value="7f000001"/>
    <field name="ip.host" showname="Source or Destination Host: 127.0.0.1" hide="yes" size="4" pos="30" show="127.0.0.1" value="7f000001"/>
  </proto>
  <proto name="tcp" showname="Transmission Control Protocol, Src Port: 6633 (6633), Dst Port: 41499 (41499), Seq: 1, Ack: 2, Len: 8" size="32" pos="34">
    <field name="tcp.srcport" showname="Source port: 6633 (6633)" size="2" pos="34" show="6633" value="19e9"/>
    <field name="tcp.dstport" showname="Destination port: 41499 (41499)" size="2" pos="36" show="41499" value="a21b"/>
    <field name="tcp.port" showname="Source or Destination Port: 6633" hide="yes" size="2" pos="34" show="6633" value="19e9"/>
    <field name="tcp.port" showname="Source or Destination Port: 41499" hide="yes" size="2" pos="36" show="41499" value="a21b"/>
    <field name="tcp.stream" showname="Stream index: 1" size="0" pos="34" show="1"/>
    <field name="tcp.len" showname="TCP Segment Len: 8" hide="yes" size="1" pos="46" show="8" value="80"/>
    <field name="tcp.seq" showname="Sequence number: 1    (relative sequence number)" size="4" pos="38" show="1" value="412611af"/>
    <field name="tcp.nxtseq" showname="Next sequence number: 9    (relative sequence number)" size="0" pos="34" show="9"/>
    <field name="tcp.ack" showname="Acknowledgement number: 2    (relative ack number)" size="4" pos="42" show="2" value="d21486bd"/>
    <field name="tcp.hdr_len" showname="Header length: 32 bytes" size="1" pos="46" show="32" value="80"/>
    <field name="tcp.flags" showname="Flags: 0x018 (PSH, ACK)" size="2" pos="46" show="0x0018" value="18" unmaskedvalue="8018">
      <field name="tcp.flags.res" showname="000. .... .... = Reserved: Not set" size="1" pos="46" show="0" value="0" unmaskedvalue="80"/>
      <field name="tcp.flags.ns" showname="...0 .... .... = Nonce: Not set" size="1" pos="46" show="0" value="0" unmaskedvalue="80"/>
      <field name="tcp.flags.cwr" showname=".... 0... .... = Congestion Window Reduced (CWR): Not set" size="1" pos="47" show="0" value="0" unmaskedvalue="18"/>
      <field name="tcp.flags.ecn" showname=".... .0.. .... = ECN-Echo: Not set" size="1" pos="47" show="0" value="0" unmaskedvalue="18"/>
      <field name="tcp.flags.urg" showname=".... ..0. .... = Urgent: Not set" size="1" pos="47" show="0" value="0" unmaskedvalue="18"/>
      <field name="tcp.flags.ack" showname=".... ...1 .... = Acknowledgement: Set" size="1" pos="47" show="1" value="1" unmaskedvalue="18"/>
      <field name="tcp.flags.push" showname=".... .... 1... = Push: Set" size="1" pos="47" show="1" value="1" unmaskedvalue="18"/>
      <field name="tcp.flags.reset" showname=".... .... .0.. = Reset: Not set" size="1" pos="47" show="0" value="0" unmaskedvalue="18"/>
      <field name="tcp.flags.syn" showname=".... .... ..0. = Syn: Not set" size="1" pos="47" show="0" value="0" unmaskedvalue="18"/>
      <field name="tcp.flags.fin" showname=".... .... ...0 = Fin: Not set" size="1" pos="47" show="0" value="0" unmaskedvalue="18"/>
    </field>
    <field name="tcp.window_size_value" showname="Window size value: 512" size="2" pos="48" show="512" value="0200"/>
    <field name="tcp.window_size" showname="Calculated window size: 32768" size="2" pos="48" show="32768" value="0200"/>
    <field name="tcp.window_size_scalefactor" showname="Window size scaling factor: 64" size="2" pos="48" show="64" value="0200"/>
    <field name="tcp.checksum" showname="Checksum: 0xfe30 [validation disabled]" size="2" pos="50" show="0xfe30" value="fe30">
      <field name="tcp.checksum_good" showname="Good Checksum: False" size="2" pos="50" show="0" value="fe30"/>
      <field name="tcp.checksum_bad" showname="Bad Checksum: False" size="2" pos="50" show="0" value="fe30"/>
    </field>
    <field name="tcp.options" showname="Options: (12 bytes)" size="12" pos="54" show="01:01:08:0a:00:00:a0:18:00:00:a0:0e" value="0101080a0000a0180000a00e">
      <field name="" show="No-Operation (NOP)" size="1" pos="54" value="01"/>
      <field name="" show="No-Operation (NOP)" size="1" pos="55" value="01"/>
      <field name="" show="Timestamps: TSval 40984, TSecr 40974" size="10" pos="56" value="080a0000a0180000a00e">
        <field name="tcp.option_kind" showname="Kind: Timestamp (8)" size="1" pos="56" show="8" value="08"/>
        <field name="tcp.option_len" showname="Length: 10" size="1" pos="57" show="10" value="0a"/>
        <field name="tcp.options.timestamp.tsval" showname="Timestamp value: 40984" size="4" pos="58" show="40984" value="0000a018"/>
        <field name="tcp.options.timestamp.tsecr" showname="Timestamp echo reply: 40974" size="4" pos="62" show="40974" value="0000a00e"/>
      </field>
    </field>
    <field name="" show="SEQ/ACK analysis" size="0" pos="34" value="">
      <field name="tcp.analysis.bytes_in_flight" showname="Bytes in flight: 8" size="0" pos="34" show="8"/>
    </field>
    <field name="tcp.pdu.size" showname="PDU Size: 8" size="8" pos="66" show="8" value="0100000800000011"/>
  </proto>
  <proto name="of" showname="OpenFlow Protocol" size="8" pos="66">
    <field name="of.header" showname="Header" size="8" pos="66" show="" value="">
      <field name="of.ver" showname="Version: 0x01" size="1" pos="66" show="0x01" value="01"/>
      <field name="of.type" showname="Type: Hello (SM) (0)" size="1" pos="67" show="0" value="00"/>
      <field name="of.len" showname="Length: 8" size="2" pos="68" show="8" value="0008"/>
      <field name="of.id" showname="Transaction ID: 17" size="4" pos="70" show="17" value="00000011"/>
    </field>
  </proto>
</packet>

<packet>
  <proto name="geninfo" pos="0" showname="General information" size="74">
    <field name="num" pos="0" show="663" showname="Number" value="297" size="74"/>
    <field name="len" pos="0" show="74" showname="Frame Length" value="4a" size="74"/>
    <field name="caplen" pos="0" show="74" showname="Captured Length" value="4a" size="74"/>
    <field name="timestamp" pos="0" show="Dec 11, 2013 09:45:59.468980000 PST" showname="Captured Time" value="1386783959.468980000" size="74"/>
  </proto>
  <proto name="frame" showname="Frame 663: 74 bytes on wire (592 bits), 74 bytes captured (592 bits)" size="74" pos="0">
    <field name="frame.time" showname="Arrival Time: Dec 11, 2013 09:45:59.468980000 PST" size="0" pos="0" show="Dec 11, 2013 09:45:59.468980000"/>
    <field name="frame.time_epoch" showname="Epoch Time: 1386783959.468980000 seconds" size="0" pos="0" show="1386783959.468980000"/>
    <field name="frame.time_delta" showname="Time delta from previous captured frame: 0.000065000 seconds" size="0" pos="0" show="0.000065000"/>
    <field name="frame.time_delta_displayed" showname="Time delta from previous displayed frame: 0.072409000 seconds" size="0" pos="0" show="0.072409000"/>
    <field name="frame.time_relative" showname="Time since reference or first frame: 49.220181000 seconds" size="0" pos="0" show="49.220181000"/>
    <field name="frame.number" showname="Frame Number: 663" size="0" pos="0" show="663"/>
    <field name="frame.len" showname="Frame Length: 74 bytes (592 bits)" size="0" pos="0" show="74"/>
    <field name="frame.cap_len" showname="Capture Length: 74 bytes (592 bits)" size="0" pos="0" show="74"/>
    <field name="frame.marked" showname="Frame is marked: False" size="0" pos="0" show="0"/>
    <field name="frame.ignored" showname="Frame is ignored: False" size="0" pos="0" show="0"/>
    <field name="frame.protocols" showname="Protocols in frame: eth:ip:tcp:of" size="0" pos="0" show="eth:ip:tcp:of"/>
    <field name="frame.coloring_rule.name" showname="Coloring Rule Name: of" size="0" pos="0" show="of"/>
    <field name="frame.coloring_rule.string" showname="Coloring Rule String: of" size="0" pos="0" show="of"/>
  </proto>
  <proto name="eth" showname="Ethernet II, Src: 00:00:00_00:00:00 (00:00:00:00:00:00), Dst: 00:00:00_00:00:00 (00:00:00:00:00:00)" size="14" pos="0">
    <field name="eth.dst" showname="Destination: 00:00:00_00:00:00 (00:00:00:00:00:00)" size="6" pos="0" show="00:00:00:00:00:00" value="000000000000">
      <field name="eth.addr" showname="Address: 00:00:00_00:00:00 (00:00:00:00:00:00)" size="6" pos="0" show="00:00:00:00:00:00" value="000000000000"/>
      <field name="eth.ig" showname=".... ...0 .... .... .... .... = IG bit: Individual address (unicast)" size="3" pos="0" show="0" value="0" unmaskedvalue="000000"/>
      <field name="eth.lg" showname=".... ..0. .... .... .... .... = LG bit: Globally unique address (factory default)" size="3" pos="0" show="0" value="0" unmaskedvalue="000000"/>
    </field>
    <field name="eth.src" showname="Source: 00:00:00_00:00:00 (00:00:00:00:00:00)" size="6" pos="6" show="00:00:00:00:00:00" value="000000000000">
      <field name="eth.addr" showname="Address: 00:00:00_00:00:00 (00:00:00:00:00:00)" size="6" pos="6" show="00:00:00:00:00:00" value="000000000000"/>
      <field name="eth.ig" showname=".... ...0 .... .... .... .... = IG bit: Individual address (unicast)" size="3" pos="6" show="0" value="0" unmaskedvalue="000000"/>
      <field name="eth.lg" showname=".... ..0. .... .... .... .... = LG bit: Globally unique address (factory default)" size="3" pos="6" show="0" value="0" unmaskedvalue="000000"/>
    </field>
    <field name="eth.type" showname="Type: IP (0x0800)" size="2" pos="12" show="0x0800" value="0800"/>
  </proto>
  <proto name="ip" showname="Internet Protocol Version 4, Src: 127.0.0.1 (127.0.0.1), Dst: 127.0.0.1 (127.0.0.1)" size="20" pos="14">
    <field name="ip.version" showname="Version: 4" size="1" pos="14" show="4" value="45"/>
    <field name="ip.hdr_len" showname="Header length: 20 bytes" size="1" pos="14" show="20" value="45"/>
    <field name="ip.dsfield" showname="Differentiated Services Field: 0x00 (DSCP 0x00: Default; ECN: 0x00: Not-ECT (Not ECN-Capable Transport))" size="1" pos="15" show="0" value="00">
      <field name="ip.dsfield.dscp" showname="0000 00.. = Differentiated Services Codepoint: Default (0x00)" size="1" pos="15" show="0x00" value="0" unmaskedvalue="00"/>
      <field name="ip.dsfield.ecn" showname=".... ..00 = Explicit Congestion Notification: Not-ECT (Not ECN-Capable Transport) (0x00)" size="1" pos="15" show="0x00" value="0" unmaskedvalue="00"/>
    </field>
    <field name="ip.len" showname="Total Length: 60" size="2" pos="16" show="60" value="003c"/>
    <field name="ip.id" showname="Identification: 0x09a5 (2469)" size="2" pos="18" show="0x09a5" value="09a5"/>
    <field name="ip.flags" showname="Flags: 0x02 (Don&apos;t Fragment)" size="1" pos="20" show="0x02" value="40">
      <field name="ip.flags.rb" showname="0... .... = Reserved bit: Not set" size="1" pos="20" show="0" value="40"/>
      <field name="ip.flags.df" showname=".1.. .... = Don&apos;t fragment: Set" size="1" pos="20" show="1" value="40"/>
      <field name="ip.flags.mf" showname="..0. .... = More fragments: Not set" size="1" pos="20" show="0" value="40"/>
    </field>
    <field name="ip.frag_offset" showname="Fragment offset: 0" size="2" pos="20" show="0" value="4000"/>
    <field name="ip.ttl" showname="Time to live: 64" size="1" pos="22" show="64" value="40"/>
    <field name="ip.proto" showname="Protocol: TCP (6)" size="1" pos="23" show="6" value="06"/>
    <field name="ip.checksum" showname="Header checksum: 0x3315 [correct]" size="2" pos="24" show="0x3315" value="3315">
      <field name="ip.checksum_good" showname="Good: True" size="2" pos="24" show="1" value="3315"/>
      <field name="ip.checksum_bad" showname="Bad: False" size="2" pos="24" show="0" value="3315"/>
    </field>
    <field name="ip.src" showname="Source: 127.0.0.1 (127.0.0.1)" size="4" pos="26" show="127.0.0.1" value="7f000001"/>
    <field name="ip.addr" showname="Source or Destination Address: 127.0.0.1 (127.0.0.1)" hide="yes" size="4" pos="26" show="127.0.0.1" value="7f000001"/>
    <field name="ip.src_host" showname="Source Host: 127.0.0.1" hide="yes" size="4" pos="26" show="127.0.0.1" value="7f000001"/>
    <field name="ip.host" showname="Source or Destination Host: 127.0.0.1" hide="yes" size="4" pos="26" show="127.0.0.1" value="7f000001"/>
    <field name="ip.dst" showname="Destination: 127.0.0.1 (127.0.0.1)" size="4" pos="30" show="127.0.0.1" value="7f000001"/>
    <field name="ip.addr" showname="Source or Destination Address: 127.0.0.1 (127.0.0.1)" hide="yes" size="4" pos="30" show="127.0.0.1" value="7f000001"/>
    <field name="ip.dst_host" showname="Destination Host: 127.0.0.1" hide="yes" size="4" pos="30" show="127.0.0.1" value="7f000001"/>
    <field name="ip.host" showname="Source or Destination Host: 127.0.0.1" hide="yes" size="4" pos="30" show="127.0.0.1" value="7f000001"/>
  </proto>
  <proto name="tcp" showname="Transmission Control Protocol, Src Port: 41500 (41500), Dst Port: 6633 (6633), Seq: 1, Ack: 1, Len: 8" size="32" pos="34">
    <field name="tcp.srcport" showname="Source port: 41500 (41500)" size="2" pos="34" show="41500" value="a21c"/>
    <field name="tcp.dstport" showname="Destination port: 6633 (6633)" size="2" pos="36" show="6633" value="19e9"/>
    <field name="tcp.port" showname="Source or Destination Port: 41500" hide="yes" size="2" pos="34" show="41500" value="a21c"/>
    <field name="tcp.port" showname="Source or Destination Port: 6633" hide="yes" size="2" pos="36" show="6633" value="19e9"/>
    <field name="tcp.stream" showname="Stream index: 2" size="0" pos="34" show="2"/>
    <field name="tcp.len" showname="TCP Segment Len: 8" hide="yes" size="1" pos="46" show="8" value="80"/>
    <field name="tcp.seq" showname="Sequence number: 1    (relative sequence number)" size="4" pos="38" show="1" value="4feca98a"/>
    <field name="tcp.nxtseq" showname="Next sequence number: 9    (relative sequence number)" size="0" pos="34" show="9"/>
    <field name="tcp.ack" showname="Acknowledgement number: 1    (relative ack number)" size="4" pos="42" show="1" value="9eb92682"/>
    <field name="tcp.hdr_len" showname="Header length: 32 bytes" size="1" pos="46" show="32" value="80"/>
    <field name="tcp.flags" showname="Flags: 0x018 (PSH, ACK)" size="2" pos="46" show="0x0018" value="18" unmaskedvalue="8018">
      <field name="tcp.flags.res" showname="000. .... .... = Reserved: Not set" size="1" pos="46" show="0" value="0" unmaskedvalue="80"/>
      <field name="tcp.flags.ns" showname="...0 .... .... = Nonce: Not set" size="1" pos="46" show="0" value="0" unmaskedvalue="80"/>
      <field name="tcp.flags.cwr" showname=".... 0... .... = Congestion Window Reduced (CWR): Not set" size="1" pos="47" show="0" value="0" unmaskedvalue="18"/>
      <field name="tcp.flags.ecn" showname=".... .0.. .... = ECN-Echo: Not set" size="1" pos="47" show="0" value="0" unmaskedvalue="18"/>
      <field name="tcp.flags.urg" showname=".... ..0. .... = Urgent: Not set" size="1" pos="47" show="0" value="0" unmaskedvalue="18"/>
      <field name="tcp.flags.ack" showname=".... ...1 .... = Acknowledgement: Set" size="1" pos="47" show="1" value="1" unmaskedvalue="18"/>
      <field name="tcp.flags.push" showname=".... .... 1... = Push: Set" size="1" pos="47" show="1" value="1" unmaskedvalue="18"/>
      <field name="tcp.flags.reset" showname=".... .... .0.. = Reset: Not set" size="1" pos="47" show="0" value="0" unmaskedvalue="18"/>
      <field name="tcp.flags.syn" showname=".... .... ..0. = Syn: Not set" size="1" pos="47" show="0" value="0" unmaskedvalue="18"/>
      <field name="tcp.flags.fin" showname=".... .... ...0 = Fin: Not set" size="1" pos="47" show="0" value="0" unmaskedvalue="18"/>
    </field>
    <field name="tcp.window_size_value" showname="Window size value: 513" size="2" pos="48" show="513" value="0201"/>
    <field name="tcp.window_size" showname="Calculated window size: 32832" size="2" pos="48" show="32832" value="0201"/>
    <field name="tcp.window_size_scalefactor" showname="Window size scaling factor: 64" size="2" pos="48" show="64" value="0201"/>
    <field name="tcp.checksum" showname="Checksum: 0xfe30 [validation disabled]" size="2" pos="50" show="0xfe30" value="fe30">
      <field name="tcp.checksum_good" showname="Good Checksum: False" size="2" pos="50" show="0" value="fe30"/>
      <field name="tcp.checksum_bad" showname="Bad Checksum: False" size="2" pos="50" show="0" value="fe30"/>
    </field>
    <field name="tcp.options" showname="Options: (12 bytes)" size="12" pos="54" show="01:01:08:0a:00:00:a0:2a:00:00:a0:2a" value="0101080a0000a02a0000a02a">
      <field name="" show="No-Operation (NOP)" size="1" pos="54" value="01"/>
      <field name="" show="No-Operation (NOP)" size="1" pos="55" value="01"/>
      <field name="" show="Timestamps: TSval 41002, TSecr 41002" size="10" pos="56" value="080a0000a02a0000a02a">
        <field name="tcp.option_kind" showname="Kind: Timestamp (8)" size="1" pos="56" show="8" value="08"/>
        <field name="tcp.option_len" showname="Length: 10" size="1" pos="57" show="10" value="0a"/>
        <field name="tcp.options.timestamp.tsval" showname="Timestamp value: 41002" size="4" pos="58" show="41002" value="0000a02a"/>
        <field name="tcp.options.timestamp.tsecr" showname="Timestamp echo reply: 41002" size="4" pos="62" show="41002" value="0000a02a"/>
      </field>
    </field>
    <field name="" show="SEQ/ACK analysis" size="0" pos="34" value="">
      <field name="tcp.analysis.bytes_in_flight" showname="Bytes in flight: 8" size="0" pos="34" show="8"/>
    </field>
    <field name="tcp.pdu.size" showname="PDU Size: 8" size="8" pos="66" show="8" value="0100000800000002"/>
  </proto>
  <proto name="of" showname="OpenFlow Protocol" size="8" pos="66">
    <field name="of.header" showname="Header" size="8" pos="66" show="" value="">
      <field name="of.ver" showname="Version: 0x01" size="1" pos="66" show="0x01" value="01"/>
      <field name="of.type" showname="Type: Hello (SM) (0)" size="1" pos="67" show="0" value="00"/>
      <field name="of.len" showname="Length: 8" size="2" pos="68" show="8" value="0008"/>
      <field name="of.id" showname="Transaction ID: 2" size="4" pos="70" show="2" value="00000002"/>
    </field>
  </proto>
</packet>

<packet>
  <proto name="geninfo" pos="0" showname="General information" size="74">
    <field name="num" pos="0" show="665" showname="Number" value="299" size="74"/>
    <field name="len" pos="0" show="74" showname="Frame Length" value="4a" size="74"/>
    <field name="caplen" pos="0" show="74" showname="Captured Length" value="4a" size="74"/>
    <field name="timestamp" pos="0" show="Dec 11, 2013 09:45:59.512224000 PST" showname="Captured Time" value="1386783959.512224000" size="74"/>
  </proto>
  <proto name="frame" showname="Frame 665: 74 bytes on wire (592 bits), 74 bytes captured (592 bits)" size="74" pos="0">
    <field name="frame.time" showname="Arrival Time: Dec 11, 2013 09:45:59.512224000 PST" size="0" pos="0" show="Dec 11, 2013 09:45:59.512224000"/>
    <field name="frame.time_epoch" showname="Epoch Time: 1386783959.512224000 seconds" size="0" pos="0" show="1386783959.512224000"/>
    <field name="frame.time_delta" showname="Time delta from previous captured frame: 0.043237000 seconds" size="0" pos="0" show="0.043237000"/>
    <field name="frame.time_delta_displayed" showname="Time delta from previous displayed frame: 0.043244000 seconds" size="0" pos="0" show="0.043244000"/>
    <field name="frame.time_relative" showname="Time since reference or first frame: 49.263425000 seconds" size="0" pos="0" show="49.263425000"/>
    <field name="frame.number" showname="Frame Number: 665" size="0" pos="0" show="665"/>
    <field name="frame.len" showname="Frame Length: 74 bytes (592 bits)" size="0" pos="0" show="74"/>
    <field name="frame.cap_len" showname="Capture Length: 74 bytes (592 bits)" size="0" pos="0" show="74"/>
    <field name="frame.marked" showname="Frame is marked: False" size="0" pos="0" show="0"/>
    <field name="frame.ignored" showname="Frame is ignored: False" size="0" pos="0" show="0"/>
    <field name="frame.protocols" showname="Protocols in frame: eth:ip:tcp:of" size="0" pos="0" show="eth:ip:tcp:of"/>
    <field name="frame.coloring_rule.name" showname="Coloring Rule Name: of" size="0" pos="0" show="of"/>
    <field name="frame.coloring_rule.string" showname="Coloring Rule String: of" size="0" pos="0" show="of"/>
  </proto>
  <proto name="eth" showname="Ethernet II, Src: 00:00:00_00:00:00 (00:00:00:00:00:00), Dst: 00:00:00_00:00:00 (00:00:00:00:00:00)" size="14" pos="0">
    <field name="eth.dst" showname="Destination: 00:00:00_00:00:00 (00:00:00:00:00:00)" size="6" pos="0" show="00:00:00:00:00:00" value="000000000000">
      <field name="eth.addr" showname="Address: 00:00:00_00:00:00 (00:00:00:00:00:00)" size="6" pos="0" show="00:00:00:00:00:00" value="000000000000"/>
      <field name="eth.ig" showname=".... ...0 .... .... .... .... = IG bit: Individual address (unicast)" size="3" pos="0" show="0" value="0" unmaskedvalue="000000"/>
      <field name="eth.lg" showname=".... ..0. .... .... .... .... = LG bit: Globally unique address (factory default)" size="3" pos="0" show="0" value="0" unmaskedvalue="000000"/>
    </field>
    <field name="eth.src" showname="Source: 00:00:00_00:00:00 (00:00:00:00:00:00)" size="6" pos="6" show="00:00:00:00:00:00" value="000000000000">
      <field name="eth.addr" showname="Address: 00:00:00_00:00:00 (00:00:00:00:00:00)" size="6" pos="6" show="00:00:00:00:00:00" value="000000000000"/>
      <field name="eth.ig" showname=".... ...0 .... .... .... .... = IG bit: Individual address (unicast)" size="3" pos="6" show="0" value="0" unmaskedvalue="000000"/>
      <field name="eth.lg" showname=".... ..0. .... .... .... .... = LG bit: Globally unique address (factory default)" size="3" pos="6" show="0" value="0" unmaskedvalue="000000"/>
    </field>
    <field name="eth.type" showname="Type: IP (0x0800)" size="2" pos="12" show="0x0800" value="0800"/>
  </proto>
  <proto name="ip" showname="Internet Protocol Version 4, Src: 127.0.0.1 (127.0.0.1), Dst: 127.0.0.1 (127.0.0.1)" size="20" pos="14">
    <field name="ip.version" showname="Version: 4" size="1" pos="14" show="4" value="45"/>
    <field name="ip.hdr_len" showname="Header length: 20 bytes" size="1" pos="14" show="20" value="45"/>
    <field name="ip.dsfield" showname="Differentiated Services Field: 0x00 (DSCP 0x00: Default; ECN: 0x00: Not-ECT (Not ECN-Capable Transport))" size="1" pos="15" show="0" value="00">
      <field name="ip.dsfield.dscp" showname="0000 00.. = Differentiated Services Codepoint: Default (0x00)" size="1" pos="15" show="0x00" value="0" unmaskedvalue="00"/>
      <field name="ip.dsfield.ecn" showname=".... ..00 = Explicit Congestion Notification: Not-ECT (Not ECN-Capable Transport) (0x00)" size="1" pos="15" show="0x00" value="0" unmaskedvalue="00"/>
    </field>
    <field name="ip.len" showname="Total Length: 60" size="2" pos="16" show="60" value="003c"/>
    <field name="ip.id" showname="Identification: 0x86a9 (34473)" size="2" pos="18" show="0x86a9" value="86a9"/>
    <field name="ip.flags" showname="Flags: 0x02 (Don&apos;t Fragment)" size="1" pos="20" show="0x02" value="40">
      <field name="ip.flags.rb" showname="0... .... = Reserved bit: Not set" size="1" pos="20" show="0" value="40"/>
      <field name="ip.flags.df" showname=".1.. .... = Don&apos;t fragment: Set" size="1" pos="20" show="1" value="40"/>
      <field name="ip.flags.mf" showname="..0. .... = More fragments: Not set" size="1" pos="20" show="0" value="40"/>
    </field>
    <field name="ip.frag_offset" showname="Fragment offset: 0" size="2" pos="20" show="0" value="4000"/>
    <field name="ip.ttl" showname="Time to live: 64" size="1" pos="22" show="64" value="40"/>
    <field name="ip.proto" showname="Protocol: TCP (6)" size="1" pos="23" show="6" value="06"/>
    <field name="ip.checksum" showname="Header checksum: 0xb610 [correct]" size="2" pos="24" show="0xb610" value="b610">
      <field name="ip.checksum_good" showname="Good: True" size="2" pos="24" show="1" value="b610"/>
      <field name="ip.checksum_bad" showname="Bad: False" size="2" pos="24" show="0" value="b610"/>
    </field>
    <field name="ip.src" showname="Source: 127.0.0.1 (127.0.0.1)" size="4" pos="26" show="127.0.0.1" value="7f000001"/>
    <field name="ip.addr" showname="Source or Destination Address: 127.0.0.1 (127.0.0.1)" hide="yes" size="4" pos="26" show="127.0.0.1" value="7f000001"/>
    <field name="ip.src_host" showname="Source Host: 127.0.0.1" hide="yes" size="4" pos="26" show="127.0.0.1" value="7f000001"/>
    <field name="ip.host" showname="Source or Destination Host: 127.0.0.1" hide="yes" size="4" pos="26" show="127.0.0.1" value="7f000001"/>
    <field name="ip.dst" showname="Destination: 127.0.0.1 (127.0.0.1)" size="4" pos="30" show="127.0.0.1" value="7f000001"/>
    <field name="ip.addr" showname="Source or Destination Address: 127.0.0.1 (127.0.0.1)" hide="yes" size="4" pos="30" show="127.0.0.1" value="7f000001"/>
    <field name="ip.dst_host" showname="Destination Host: 127.0.0.1" hide="yes" size="4" pos="30" show="127.0.0.1" value="7f000001"/>
    <field name="ip.host" showname="Source or Destination Host: 127.0.0.1" hide="yes" size="4" pos="30" show="127.0.0.1" value="7f000001"/>
  </proto>
  <proto name="tcp" showname="Transmission Control Protocol, Src Port: 6633 (6633), Dst Port: 41500 (41500), Seq: 1, Ack: 9, Len: 8" size="32" pos="34">
    <field name="tcp.srcport" showname="Source port: 6633 (6633)" size="2" pos="34" show="6633" value="19e9"/>
    <field name="tcp.dstport" showname="Destination port: 41500 (41500)" size="2" pos="36" show="41500" value="a21c"/>
    <field name="tcp.port" showname="Source or Destination Port: 6633" hide="yes" size="2" pos="34" show="6633" value="19e9"/>
    <field name="tcp.port" showname="Source or Destination Port: 41500" hide="yes" size="2" pos="36" show="41500" value="a21c"/>
    <field name="tcp.stream" showname="Stream index: 2" size="0" pos="34" show="2"/>
    <field name="tcp.len" showname="TCP Segment Len: 8" hide="yes" size="1" pos="46" show="8" value="80"/>
    <field name="tcp.seq" showname="Sequence number: 1    (relative sequence number)" size="4" pos="38" show="1" value="9eb92682"/>
    <field name="tcp.nxtseq" showname="Next sequence number: 9    (relative sequence number)" size="0" pos="34" show="9"/>
    <field name="tcp.ack" showname="Acknowledgement number: 9    (relative ack number)" size="4" pos="42" show="9" value="4feca992"/>
    <field name="tcp.hdr_len" showname="Header length: 32 bytes" size="1" pos="46" show="32" value="80"/>
    <field name="tcp.flags" showname="Flags: 0x018 (PSH, ACK)" size="2" pos="46" show="0x0018" value="18" unmaskedvalue="8018">
      <field name="tcp.flags.res" showname="000. .... .... = Reserved: Not set" size="1" pos="46" show="0" value="0" unmaskedvalue="80"/>
      <field name="tcp.flags.ns" showname="...0 .... .... = Nonce: Not set" size="1" pos="46" show="0" value="0" unmaskedvalue="80"/>
      <field name="tcp.flags.cwr" showname=".... 0... .... = Congestion Window Reduced (CWR): Not set" size="1" pos="47" show="0" value="0" unmaskedvalue="18"/>
      <field name="tcp.flags.ecn" showname=".... .0.. .... = ECN-Echo: Not set" size="1" pos="47" show="0" value="0" unmaskedvalue="18"/>
      <field name="tcp.flags.urg" showname=".... ..0. .... = Urgent: Not set" size="1" pos="47" show="0" value="0" unmaskedvalue="18"/>
      <field name="tcp.flags.ack" showname=".... ...1 .... = Acknowledgement: Set" size="1" pos="47" show="1" value="1" unmaskedvalue="18"/>
      <field name="tcp.flags.push" showname=".... .... 1... = Push: Set" size="1" pos="47" show="1" value="1" unmaskedvalue="18"/>
      <field name="tcp.flags.reset" showname=".... .... .0.. = Reset: Not set" size="1" pos="47" show="0" value="0" unmaskedvalue="18"/>
      <field name="tcp.flags.syn" showname=".... .... ..0. = Syn: Not set" size="1" pos="47" show="0" value="0" unmaskedvalue="18"/>
      <field name="tcp.flags.fin" showname=".... .... ...0 = Fin: Not set" size="1" pos="47" show="0" value="0" unmaskedvalue="18"/>
    </field>
    <field name="tcp.window_size_value" showname="Window size value: 512" size="2" pos="48" show="512" value="0200"/>
    <field name="tcp.window_size" showname="Calculated window size: 32768" size="2" pos="48" show="32768" value="0200"/>
    <field name="tcp.window_size_scalefactor" showname="Window size scaling factor: 64" size="2" pos="48" show="64" value="0200"/>
    <field name="tcp.checksum" showname="Checksum: 0xfe30 [validation disabled]" size="2" pos="50" show="0xfe30" value="fe30">
      <field name="tcp.checksum_good" showname="Good Checksum: False" size="2" pos="50" show="0" value="fe30"/>
      <field name="tcp.checksum_bad" showname="Bad Checksum: False" size="2" pos="50" show="0" value="fe30"/>
    </field>
    <field name="tcp.options" showname="Options: (12 bytes)" size="12" pos="54" show="01:01:08:0a:00:00:a0:35:00:00:a0:2a" value="0101080a0000a0350000a02a">
      <field name="" show="No-Operation (NOP)" size="1" pos="54" value="01"/>
      <field name="" show="No-Operation (NOP)" size="1" pos="55" value="01"/>
      <field name="" show="Timestamps: TSval 41013, TSecr 41002" size="10" pos="56" value="080a0000a0350000a02a">
        <field name="tcp.option_kind" showname="Kind: Timestamp (8)" size="1" pos="56" show="8" value="08"/>
        <field name="tcp.option_len" showname="Length: 10" size="1" pos="57" show="10" value="0a"/>
        <field name="tcp.options.timestamp.tsval" showname="Timestamp value: 41013" size="4" pos="58" show="41013" value="0000a035"/>
        <field name="tcp.options.timestamp.tsecr" showname="Timestamp echo reply: 41002" size="4" pos="62" show="41002" value="0000a02a"/>
      </field>
    </field>
    <field name="" show="SEQ/ACK analysis" size="0" pos="34" value="">
      <field name="tcp.analysis.bytes_in_flight" showname="Bytes in flight: 8" size="0" pos="34" show="8"/>
    </field>
    <field name="tcp.pdu.size" showname="PDU Size: 8" size="8" pos="66" show="8" value="0100000800000012"/>
  </proto>
  <proto name="of" showname="OpenFlow Protocol" size="8" pos="66">
    <field name="of.header" showname="Header" size="8" pos="66" show="" value="">
      <field name="of.ver" showname="Version: 0x01" size="1" pos="66" show="0x01" value="01"/>
      <field name="of.type" showname="Type: Hello (SM) (0)" size="1" pos="67" show="0" value="00"/>
      <field name="of.len" showname="Length: 8" size="2" pos="68" show="8" value="0008"/>
      <field name="of.id" showname="Transaction ID: 18" size="4" pos="70" show="18" value="00000012"/>
    </field>
  </proto>
</packet>

<packet>
  <proto name="geninfo" pos="0" showname="General information" size="74">
    <field name="num" pos="0" show="667" showname="Number" value="29b" size="74"/>
    <field name="len" pos="0" show="74" showname="Frame Length" value="4a" size="74"/>
    <field name="caplen" pos="0" show="74" showname="Captured Length" value="4a" size="74"/>
    <field name="timestamp" pos="0" show="Dec 11, 2013 09:45:59.512469000 PST" showname="Captured Time" value="1386783959.512469000" size="74"/>
  </proto>
  <proto name="frame" showname="Frame 667: 74 bytes on wire (592 bits), 74 bytes captured (592 bits)" size="74" pos="0">
    <field name="frame.time" showname="Arrival Time: Dec 11, 2013 09:45:59.512469000 PST" size="0" pos="0" show="Dec 11, 2013 09:45:59.512469000"/>
    <field name="frame.time_epoch" showname="Epoch Time: 1386783959.512469000 seconds" size="0" pos="0" show="1386783959.512469000"/>
    <field name="frame.time_delta" showname="Time delta from previous captured frame: 0.000206000 seconds" size="0" pos="0" show="0.000206000"/>
    <field name="frame.time_delta_displayed" showname="Time delta from previous displayed frame: 0.000245000 seconds" size="0" pos="0" show="0.000245000"/>
    <field name="frame.time_relative" showname="Time since reference or first frame: 49.263670000 seconds" size="0" pos="0" show="49.263670000"/>
    <field name="frame.number" showname="Frame Number: 667" size="0" pos="0" show="667"/>
    <field name="frame.len" showname="Frame Length: 74 bytes (592 bits)" size="0" pos="0" show="74"/>
    <field name="frame.cap_len" showname="Capture Length: 74 bytes (592 bits)" size="0" pos="0" show="74"/>
    <field name="frame.marked" showname="Frame is marked: False" size="0" pos="0" show="0"/>
    <field name="frame.ignored" showname="Frame is ignored: False" size="0" pos="0" show="0"/>
    <field name="frame.protocols" showname="Protocols in frame: eth:ip:tcp:of" size="0" pos="0" show="eth:ip:tcp:of"/>
    <field name="frame.coloring_rule.name" showname="Coloring Rule Name: of" size="0" pos="0" show="of"/>
