<?xml version="1.0"?>
<?xml-stylesheet type="text/xsl" href="pdml2html.xsl"?>
<!-- You can find pdml2html.xsl in /usr/share/wireshark or at http://anonsvn.wireshark.org/trunk/wireshark/pdml2html.xsl. -->
<pdml version="0" creator="wireshark/1.6.7" time="Mon Dec  9 13:18:35 2013" capture_file="/tmp/wireshark_any_20131209130914_flwOeW">
<packet>
  <proto name="geninfo" pos="0" showname="General information" size="76">
    <field name="num" pos="0" show="1118" showname="Number" value="45e" size="76"/>
    <field name="len" pos="0" show="76" showname="Frame Length" value="4c" size="76"/>
    <field name="caplen" pos="0" show="76" showname="Captured Length" value="4c" size="76"/>
    <field name="timestamp" pos="0" show="Dec  9, 2013 13:09:20.330872000 PST" showname="Captured Time" value="1386623360.330872000" size="76"/>
  </proto>
  <proto name="frame" showname="Frame 1118: 76 bytes on wire (608 bits), 76 bytes captured (608 bits)" size="76" pos="0">
    <field name="frame.time" showname="Arrival Time: Dec  9, 2013 13:09:20.330872000 PST" size="0" pos="0" show="Dec  9, 2013 13:09:20.330872000"/>
    <field name="frame.time_epoch" showname="Epoch Time: 1386623360.330872000 seconds" size="0" pos="0" show="1386623360.330872000"/>
    <field name="frame.time_delta" showname="Time delta from previous captured frame: 0.000531000 seconds" size="0" pos="0" show="0.000531000"/>
    <field name="frame.time_delta_displayed" showname="Time delta from previous displayed frame: 0.000000000 seconds" size="0" pos="0" show="0.000000000"/>
    <field name="frame.time_relative" showname="Time since reference or first frame: 5.449699000 seconds" size="0" pos="0" show="5.449699000"/>
    <field name="frame.number" showname="Frame Number: 1118" size="0" pos="0" show="1118"/>
    <field name="frame.len" showname="Frame Length: 76 bytes (608 bits)" size="0" pos="0" show="76"/>
    <field name="frame.cap_len" showname="Capture Length: 76 bytes (608 bits)" size="0" pos="0" show="76"/>
    <field name="frame.marked" showname="Frame is marked: False" size="0" pos="0" show="0"/>
    <field name="frame.ignored" showname="Frame is ignored: False" size="0" pos="0" show="0"/>
    <field name="frame.protocols" showname="Protocols in frame: sll:ip:tcp:of" size="0" pos="0" show="sll:ip:tcp:of"/>
    <field name="frame.coloring_rule.name" showname="Coloring Rule Name: of" size="0" pos="0" show="of"/>
    <field name="frame.coloring_rule.string" showname="Coloring Rule String: of" size="0" pos="0" show="of"/>
  </proto>
  <proto name="sll" showname="Linux cooked capture" size="16" pos="0">
    <field name="sll.pkttype" showname="Packet type: Unicast to us (0)" size="2" pos="0" show="0" value="0000"/>
    <field name="sll.hatype" showname="Link-layer address type: 772" size="2" pos="2" show="772" value="0304"/>
    <field name="sll.halen" showname="Link-layer address length: 6" size="2" pos="4" show="6" value="0006"/>
    <field name="sll.src.eth" showname="Source: 00:00:00_00:00:00 (00:00:00:00:00:00)" size="6" pos="6" show="00:00:00:00:00:00" value="000000000000"/>
    <field name="sll.etype" showname="Protocol: IP (0x0800)" size="2" pos="14" show="0x0800" value="0800"/>
  </proto>
  <proto name="ip" showname="Internet Protocol Version 4, Src: 127.0.0.1 (127.0.0.1), Dst: 127.0.0.1 (127.0.0.1)" size="20" pos="16">
    <field name="ip.version" showname="Version: 4" size="1" pos="16" show="4" value="45"/>
    <field name="ip.hdr_len" showname="Header length: 20 bytes" size="1" pos="16" show="20" value="45"/>
    <field name="ip.dsfield" showname="Differentiated Services Field: 0x00 (DSCP 0x00: Default; ECN: 0x00: Not-ECT (Not ECN-Capable Transport))" size="1" pos="17" show="0" value="00">
      <field name="ip.dsfield.dscp" showname="0000 00.. = Differentiated Services Codepoint: Default (0x00)" size="1" pos="17" show="0x00" value="0" unmaskedvalue="00"/>
      <field name="ip.dsfield.ecn" showname=".... ..00 = Explicit Congestion Notification: Not-ECT (Not ECN-Capable Transport) (0x00)" size="1" pos="17" show="0x00" value="0" unmaskedvalue="00"/>
    </field>
    <field name="ip.len" showname="Total Length: 60" size="2" pos="18" show="60" value="003c"/>
    <field name="ip.id" showname="Identification: 0x7382 (29570)" size="2" pos="20" show="0x7382" value="7382"/>
    <field name="ip.flags" showname="Flags: 0x02 (Don&apos;t Fragment)" size="1" pos="22" show="0x02" value="40">
      <field name="ip.flags.rb" showname="0... .... = Reserved bit: Not set" size="1" pos="22" show="0" value="40"/>
      <field name="ip.flags.df" showname=".1.. .... = Don&apos;t fragment: Set" size="1" pos="22" show="1" value="40"/>
      <field name="ip.flags.mf" showname="..0. .... = More fragments: Not set" size="1" pos="22" show="0" value="40"/>
    </field>
    <field name="ip.frag_offset" showname="Fragment offset: 0" size="2" pos="22" show="0" value="4000"/>
    <field name="ip.ttl" showname="Time to live: 64" size="1" pos="24" show="64" value="40"/>
    <field name="ip.proto" showname="Protocol: TCP (6)" size="1" pos="25" show="6" value="06"/>
    <field name="ip.checksum" showname="Header checksum: 0xc937 [correct]" size="2" pos="26" show="0xc937" value="c937">
      <field name="ip.checksum_good" showname="Good: True" size="2" pos="26" show="1" value="c937"/>
      <field name="ip.checksum_bad" showname="Bad: False" size="2" pos="26" show="0" value="c937"/>
    </field>
    <field name="ip.src" showname="Source: 127.0.0.1 (127.0.0.1)" size="4" pos="28" show="127.0.0.1" value="7f000001"/>
    <field name="ip.addr" showname="Source or Destination Address: 127.0.0.1 (127.0.0.1)" hide="yes" size="4" pos="28" show="127.0.0.1" value="7f000001"/>
    <field name="ip.src_host" showname="Source Host: 127.0.0.1" hide="yes" size="4" pos="28" show="127.0.0.1" value="7f000001"/>
    <field name="ip.host" showname="Source or Destination Host: 127.0.0.1" hide="yes" size="4" pos="28" show="127.0.0.1" value="7f000001"/>
    <field name="ip.dst" showname="Destination: 127.0.0.1 (127.0.0.1)" size="4" pos="32" show="127.0.0.1" value="7f000001"/>
    <field name="ip.addr" showname="Source or Destination Address: 127.0.0.1 (127.0.0.1)" hide="yes" size="4" pos="32" show="127.0.0.1" value="7f000001"/>
    <field name="ip.dst_host" showname="Destination Host: 127.0.0.1" hide="yes" size="4" pos="32" show="127.0.0.1" value="7f000001"/>
    <field name="ip.host" showname="Source or Destination Host: 127.0.0.1" hide="yes" size="4" pos="32" show="127.0.0.1" value="7f000001"/>
  </proto>
  <proto name="tcp" showname="Transmission Control Protocol, Src Port: 6633 (6633), Dst Port: 34808 (34808), Seq: 1, Ack: 2, Len: 8" size="32" pos="36">
    <field name="tcp.srcport" showname="Source port: 6633 (6633)" size="2" pos="36" show="6633" value="19e9"/>
    <field name="tcp.dstport" showname="Destination port: 34808 (34808)" size="2" pos="38" show="34808" value="87f8"/>
    <field name="tcp.port" showname="Source or Destination Port: 6633" hide="yes" size="2" pos="36" show="6633" value="19e9"/>
    <field name="tcp.port" showname="Source or Destination Port: 34808" hide="yes" size="2" pos="38" show="34808" value="87f8"/>
    <field name="tcp.stream" showname="Stream index: 3" size="0" pos="36" show="3"/>
    <field name="tcp.len" showname="TCP Segment Len: 8" hide="yes" size="1" pos="48" show="8" value="80"/>
    <field name="tcp.seq" showname="Sequence number: 1    (relative sequence number)" size="4" pos="40" show="1" value="a675bc1e"/>
    <field name="tcp.nxtseq" showname="Next sequence number: 9    (relative sequence number)" size="0" pos="36" show="9"/>
    <field name="tcp.ack" showname="Acknowledgement number: 2    (relative ack number)" size="4" pos="44" show="2" value="2362ff9a"/>
    <field name="tcp.hdr_len" showname="Header length: 32 bytes" size="1" pos="48" show="32" value="80"/>
    <field name="tcp.flags" showname="Flags: 0x018 (PSH, ACK)" size="2" pos="48" show="0x0018" value="18" unmaskedvalue="8018">
      <field name="tcp.flags.res" showname="000. .... .... = Reserved: Not set" size="1" pos="48" show="0" value="0" unmaskedvalue="80"/>
      <field name="tcp.flags.ns" showname="...0 .... .... = Nonce: Not set" size="1" pos="48" show="0" value="0" unmaskedvalue="80"/>
      <field name="tcp.flags.cwr" showname=".... 0... .... = Congestion Window Reduced (CWR): Not set" size="1" pos="49" show="0" value="0" unmaskedvalue="18"/>
      <field name="tcp.flags.ecn" showname=".... .0.. .... = ECN-Echo: Not set" size="1" pos="49" show="0" value="0" unmaskedvalue="18"/>
      <field name="tcp.flags.urg" showname=".... ..0. .... = Urgent: Not set" size="1" pos="49" show="0" value="0" unmaskedvalue="18"/>
      <field name="tcp.flags.ack" showname=".... ...1 .... = Acknowledgement: Set" size="1" pos="49" show="1" value="1" unmaskedvalue="18"/>
      <field name="tcp.flags.push" showname=".... .... 1... = Push: Set" size="1" pos="49" show="1" value="1" unmaskedvalue="18"/>
      <field name="tcp.flags.reset" showname=".... .... .0.. = Reset: Not set" size="1" pos="49" show="0" value="0" unmaskedvalue="18"/>
      <field name="tcp.flags.syn" showname=".... .... ..0. = Syn: Not set" size="1" pos="49" show="0" value="0" unmaskedvalue="18"/>
      <field name="tcp.flags.fin" showname=".... .... ...0 = Fin: Not set" size="1" pos="49" show="0" value="0" unmaskedvalue="18"/>
    </field>
    <field name="tcp.window_size_value" showname="Window size value: 512" size="2" pos="50" show="512" value="0200"/>
    <field name="tcp.window_size" showname="Calculated window size: 32768" size="2" pos="50" show="32768" value="0200"/>
    <field name="tcp.window_size_scalefactor" showname="Window size scaling factor: 64" size="2" pos="50" show="64" value="0200"/>
    <field name="tcp.checksum" showname="Checksum: 0xfe30 [validation disabled]" size="2" pos="52" show="0xfe30" value="fe30">
      <field name="tcp.checksum_good" showname="Good Checksum: False" size="2" pos="52" show="0" value="fe30"/>
      <field name="tcp.checksum_bad" showname="Bad Checksum: False" size="2" pos="52" show="0" value="fe30"/>
    </field>
    <field name="tcp.options" showname="Options: (12 bytes)" size="12" pos="56" show="01:01:08:0a:00:03:cf:a1:00:03:cf:9f" value="0101080a0003cfa10003cf9f">
      <field name="" show="No-Operation (NOP)" size="1" pos="56" value="01"/>
      <field name="" show="No-Operation (NOP)" size="1" pos="57" value="01"/>
      <field name="" show="Timestamps: TSval 249761, TSecr 249759" size="10" pos="58" value="080a0003cfa10003cf9f">
        <field name="tcp.option_kind" showname="Kind: Timestamp (8)" size="1" pos="58" show="8" value="08"/>
        <field name="tcp.option_len" showname="Length: 10" size="1" pos="59" show="10" value="0a"/>
        <field name="tcp.options.timestamp.tsval" showname="Timestamp value: 249761" size="4" pos="60" show="249761" value="0003cfa1"/>
        <field name="tcp.options.timestamp.tsecr" showname="Timestamp echo reply: 249759" size="4" pos="64" show="249759" value="0003cf9f"/>
      </field>
    </field>
    <field name="" show="SEQ/ACK analysis" size="0" pos="36" value="">
      <field name="tcp.analysis.bytes_in_flight" showname="Bytes in flight: 8" size="0" pos="36" show="8"/>
    </field>
    <field name="tcp.pdu.size" showname="PDU Size: 8" size="8" pos="68" show="8" value="0100000800000028"/>
  </proto>
  <proto name="of" showname="OpenFlow Protocol" size="8" pos="68">
    <field name="of.header" showname="Header" size="8" pos="68" show="" value="">
      <field name="of.ver" showname="Version: 0x01" size="1" pos="68" show="0x01" value="01"/>
      <field name="of.type" showname="Type: Hello (SM) (0)" size="1" pos="69" show="0" value="00"/>
      <field name="of.len" showname="Length: 8" size="2" pos="70" show="8" value="0008"/>
      <field name="of.id" showname="Transaction ID: 40" size="4" pos="72" show="40" value="00000028"/>
    </field>
  </proto>
</packet>

<packet>
  <proto name="geninfo" pos="0" showname="General information" size="76">
    <field name="num" pos="0" show="1162" showname="Number" value="48a" size="76"/>
    <field name="len" pos="0" show="76" showname="Frame Length" value="4c" size="76"/>
    <field name="caplen" pos="0" show="76" showname="Captured Length" value="4c" size="76"/>
    <field name="timestamp" pos="0" show="Dec  9, 2013 13:09:20.423320000 PST" showname="Captured Time" value="1386623360.423320000" size="76"/>
  </proto>
  <proto name="frame" showname="Frame 1162: 76 bytes on wire (608 bits), 76 bytes captured (608 bits)" size="76" pos="0">
    <field name="frame.time" showname="Arrival Time: Dec  9, 2013 13:09:20.423320000 PST" size="0" pos="0" show="Dec  9, 2013 13:09:20.423320000"/>
    <field name="frame.time_epoch" showname="Epoch Time: 1386623360.423320000 seconds" size="0" pos="0" show="1386623360.423320000"/>
    <field name="frame.time_delta" showname="Time delta from previous captured frame: 0.000083000 seconds" size="0" pos="0" show="0.000083000"/>
    <field name="frame.time_delta_displayed" showname="Time delta from previous displayed frame: 0.092448000 seconds" size="0" pos="0" show="0.092448000"/>
    <field name="frame.time_relative" showname="Time since reference or first frame: 5.542147000 seconds" size="0" pos="0" show="5.542147000"/>
    <field name="frame.number" showname="Frame Number: 1162" size="0" pos="0" show="1162"/>
    <field name="frame.len" showname="Frame Length: 76 bytes (608 bits)" size="0" pos="0" show="76"/>
    <field name="frame.cap_len" showname="Capture Length: 76 bytes (608 bits)" size="0" pos="0" show="76"/>
    <field name="frame.marked" showname="Frame is marked: False" size="0" pos="0" show="0"/>
    <field name="frame.ignored" showname="Frame is ignored: False" size="0" pos="0" show="0"/>
    <field name="frame.protocols" showname="Protocols in frame: sll:ip:tcp:of" size="0" pos="0" show="sll:ip:tcp:of"/>
    <field name="frame.coloring_rule.name" showname="Coloring Rule Name: of" size="0" pos="0" show="of"/>
    <field name="frame.coloring_rule.string" showname="Coloring Rule String: of" size="0" pos="0" show="of"/>
  </proto>
  <proto name="sll" showname="Linux cooked capture" size="16" pos="0">
    <field name="sll.pkttype" showname="Packet type: Unicast to us (0)" size="2" pos="0" show="0" value="0000"/>
    <field name="sll.hatype" showname="Link-layer address type: 772" size="2" pos="2" show="772" value="0304"/>
    <field name="sll.halen" showname="Link-layer address length: 6" size="2" pos="4" show="6" value="0006"/>
    <field name="sll.src.eth" showname="Source: 00:00:00_00:00:00 (00:00:00:00:00:00)" size="6" pos="6" show="00:00:00:00:00:00" value="000000000000"/>
    <field name="sll.etype" showname="Protocol: IP (0x0800)" size="2" pos="14" show="0x0800" value="0800"/>
  </proto>
  <proto name="ip" showname="Internet Protocol Version 4, Src: 127.0.0.1 (127.0.0.1), Dst: 127.0.0.1 (127.0.0.1)" size="20" pos="16">
    <field name="ip.version" showname="Version: 4" size="1" pos="16" show="4" value="45"/>
    <field name="ip.hdr_len" showname="Header length: 20 bytes" size="1" pos="16" show="20" value="45"/>
    <field name="ip.dsfield" showname="Differentiated Services Field: 0x00 (DSCP 0x00: Default; ECN: 0x00: Not-ECT (Not ECN-Capable Transport))" size="1" pos="17" show="0" value="00">
      <field name="ip.dsfield.dscp" showname="0000 00.. = Differentiated Services Codepoint: Default (0x00)" size="1" pos="17" show="0x00" value="0" unmaskedvalue="00"/>
      <field name="ip.dsfield.ecn" showname=".... ..00 = Explicit Congestion Notification: Not-ECT (Not ECN-Capable Transport) (0x00)" size="1" pos="17" show="0x00" value="0" unmaskedvalue="00"/>
    </field>
    <field name="ip.len" showname="Total Length: 60" size="2" pos="18" show="60" value="003c"/>
    <field name="ip.id" showname="Identification: 0x5c7d (23677)" size="2" pos="20" show="0x5c7d" value="5c7d"/>
    <field name="ip.flags" showname="Flags: 0x02 (Don&apos;t Fragment)" size="1" pos="22" show="0x02" value="40">
      <field name="ip.flags.rb" showname="0... .... = Reserved bit: Not set" size="1" pos="22" show="0" value="40"/>
      <field name="ip.flags.df" showname=".1.. .... = Don&apos;t fragment: Set" size="1" pos="22" show="1" value="40"/>
      <field name="ip.flags.mf" showname="..0. .... = More fragments: Not set" size="1" pos="22" show="0" value="40"/>
    </field>
    <field name="ip.frag_offset" showname="Fragment offset: 0" size="2" pos="22" show="0" value="4000"/>
    <field name="ip.ttl" showname="Time to live: 64" size="1" pos="24" show="64" value="40"/>
    <field name="ip.proto" showname="Protocol: TCP (6)" size="1" pos="25" show="6" value="06"/>
    <field name="ip.checksum" showname="Header checksum: 0xe03c [correct]" size="2" pos="26" show="0xe03c" value="e03c">
      <field name="ip.checksum_good" showname="Good: True" size="2" pos="26" show="1" value="e03c"/>
      <field name="ip.checksum_bad" showname="Bad: False" size="2" pos="26" show="0" value="e03c"/>
    </field>
    <field name="ip.src" showname="Source: 127.0.0.1 (127.0.0.1)" size="4" pos="28" show="127.0.0.1" value="7f000001"/>
    <field name="ip.addr" showname="Source or Destination Address: 127.0.0.1 (127.0.0.1)" hide="yes" size="4" pos="28" show="127.0.0.1" value="7f000001"/>
    <field name="ip.src_host" showname="Source Host: 127.0.0.1" hide="yes" size="4" pos="28" show="127.0.0.1" value="7f000001"/>
    <field name="ip.host" showname="Source or Destination Host: 127.0.0.1" hide="yes" size="4" pos="28" show="127.0.0.1" value="7f000001"/>
    <field name="ip.dst" showname="Destination: 127.0.0.1 (127.0.0.1)" size="4" pos="32" show="127.0.0.1" value="7f000001"/>
    <field name="ip.addr" showname="Source or Destination Address: 127.0.0.1 (127.0.0.1)" hide="yes" size="4" pos="32" show="127.0.0.1" value="7f000001"/>
    <field name="ip.dst_host" showname="Destination Host: 127.0.0.1" hide="yes" size="4" pos="32" show="127.0.0.1" value="7f000001"/>
    <field name="ip.host" showname="Source or Destination Host: 127.0.0.1" hide="yes" size="4" pos="32" show="127.0.0.1" value="7f000001"/>
  </proto>
  <proto name="tcp" showname="Transmission Control Protocol, Src Port: 34809 (34809), Dst Port: 6633 (6633), Seq: 1, Ack: 1, Len: 8" size="32" pos="36">
    <field name="tcp.srcport" showname="Source port: 34809 (34809)" size="2" pos="36" show="34809" value="87f9"/>
    <field name="tcp.dstport" showname="Destination port: 6633 (6633)" size="2" pos="38" show="6633" value="19e9"/>
    <field name="tcp.port" showname="Source or Destination Port: 34809" hide="yes" size="2" pos="36" show="34809" value="87f9"/>
    <field name="tcp.port" showname="Source or Destination Port: 6633" hide="yes" size="2" pos="38" show="6633" value="19e9"/>
    <field name="tcp.stream" showname="Stream index: 6" size="0" pos="36" show="6"/>
    <field name="tcp.len" showname="TCP Segment Len: 8" hide="yes" size="1" pos="48" show="8" value="80"/>
    <field name="tcp.seq" showname="Sequence number: 1    (relative sequence number)" size="4" pos="40" show="1" value="237b93c4"/>
    <field name="tcp.nxtseq" showname="Next sequence number: 9    (relative sequence number)" size="0" pos="36" show="9"/>
    <field name="tcp.ack" showname="Acknowledgement number: 1    (relative ack number)" size="4" pos="44" show="1" value="5543c468"/>
    <field name="tcp.hdr_len" showname="Header length: 32 bytes" size="1" pos="48" show="32" value="80"/>
    <field name="tcp.flags" showname="Flags: 0x018 (PSH, ACK)" size="2" pos="48" show="0x0018" value="18" unmaskedvalue="8018">
      <field name="tcp.flags.res" showname="000. .... .... = Reserved: Not set" size="1" pos="48" show="0" value="0" unmaskedvalue="80"/>
      <field name="tcp.flags.ns" showname="...0 .... .... = Nonce: Not set" size="1" pos="48" show="0" value="0" unmaskedvalue="80"/>
      <field name="tcp.flags.cwr" showname=".... 0... .... = Congestion Window Reduced (CWR): Not set" size="1" pos="49" show="0" value="0" unmaskedvalue="18"/>
      <field name="tcp.flags.ecn" showname=".... .0.. .... = ECN-Echo: Not set" size="1" pos="49" show="0" value="0" unmaskedvalue="18"/>
      <field name="tcp.flags.urg" showname=".... ..0. .... = Urgent: Not set" size="1" pos="49" show="0" value="0" unmaskedvalue="18"/>
      <field name="tcp.flags.ack" showname=".... ...1 .... = Acknowledgement: Set" size="1" pos="49" show="1" value="1" unmaskedvalue="18"/>
      <field name="tcp.flags.push" showname=".... .... 1... = Push: Set" size="1" pos="49" show="1" value="1" unmaskedvalue="18"/>
      <field name="tcp.flags.reset" showname=".... .... .0.. = Reset: Not set" size="1" pos="49" show="0" value="0" unmaskedvalue="18"/>
      <field name="tcp.flags.syn" showname=".... .... ..0. = Syn: Not set" size="1" pos="49" show="0" value="0" unmaskedvalue="18"/>
      <field name="tcp.flags.fin" showname=".... .... ...0 = Fin: Not set" size="1" pos="49" show="0" value="0" unmaskedvalue="18"/>
    </field>
    <field name="tcp.window_size_value" showname="Window size value: 513" size="2" pos="50" show="513" value="0201"/>
    <field name="tcp.window_size" showname="Calculated window size: 32832" size="2" pos="50" show="32832" value="0201"/>
    <field name="tcp.window_size_scalefactor" showname="Window size scaling factor: 64" size="2" pos="50" show="64" value="0201"/>
    <field name="tcp.checksum" showname="Checksum: 0xfe30 [validation disabled]" size="2" pos="52" show="0xfe30" value="fe30">
      <field name="tcp.checksum_good" showname="Good Checksum: False" size="2" pos="52" show="0" value="fe30"/>
      <field name="tcp.checksum_bad" showname="Bad Checksum: False" size="2" pos="52" show="0" value="fe30"/>
    </field>
    <field name="tcp.options" showname="Options: (12 bytes)" size="12" pos="56" show="01:01:08:0a:00:03:cf:b8:00:03:cf:b8" value="0101080a0003cfb80003cfb8">
      <field name="" show="No-Operation (NOP)" size="1" pos="56" value="01"/>
      <field name="" show="No-Operation (NOP)" size="1" pos="57" value="01"/>
      <field name="" show="Timestamps: TSval 249784, TSecr 249784" size="10" pos="58" value="080a0003cfb80003cfb8">
        <field name="tcp.option_kind" showname="Kind: Timestamp (8)" size="1" pos="58" show="8" value="08"/>
        <field name="tcp.option_len" showname="Length: 10" size="1" pos="59" show="10" value="0a"/>
        <field name="tcp.options.timestamp.tsval" showname="Timestamp value: 249784" size="4" pos="60" show="249784" value="0003cfb8"/>
        <field name="tcp.options.timestamp.tsecr" showname="Timestamp echo reply: 249784" size="4" pos="64" show="249784" value="0003cfb8"/>
      </field>
    </field>
    <field name="" show="SEQ/ACK analysis" size="0" pos="36" value="">
      <field name="tcp.analysis.bytes_in_flight" showname="Bytes in flight: 8" size="0" pos="36" show="8"/>
    </field>
    <field name="tcp.pdu.size" showname="PDU Size: 8" size="8" pos="68" show="8" value="0100000800000009"/>
  </proto>
  <proto name="of" showname="OpenFlow Protocol" size="8" pos="68">
    <field name="of.header" showname="Header" size="8" pos="68" show="" value="">
      <field name="of.ver" showname="Version: 0x01" size="1" pos="68" show="0x01" value="01"/>
      <field name="of.type" showname="Type: Hello (SM) (0)" size="1" pos="69" show="0" value="00"/>
      <field name="of.len" showname="Length: 8" size="2" pos="70" show="8" value="0008"/>
      <field name="of.id" showname="Transaction ID: 9" size="4" pos="72" show="9" value="00000009"/>
    </field>
  </proto>
</packet>

<packet>
  <proto name="geninfo" pos="0" showname="General information" size="76">
    <field name="num" pos="0" show="1169" showname="Number" value="491" size="76"/>
    <field name="len" pos="0" show="76" showname="Frame Length" value="4c" size="76"/>
    <field name="caplen" pos="0" show="76" showname="Captured Length" value="4c" size="76"/>
    <field name="timestamp" pos="0" show="Dec  9, 2013 13:09:20.447675000 PST" showname="Captured Time" value="1386623360.447675000" size="76"/>
  </proto>
  <proto name="frame" showname="Frame 1169: 76 bytes on wire (608 bits), 76 bytes captured (608 bits)" size="76" pos="0">
    <field name="frame.time" showname="Arrival Time: Dec  9, 2013 13:09:20.447675000 PST" size="0" pos="0" show="Dec  9, 2013 13:09:20.447675000"/>
    <field name="frame.time_epoch" showname="Epoch Time: 1386623360.447675000 seconds" size="0" pos="0" show="1386623360.447675000"/>
    <field name="frame.time_delta" showname="Time delta from previous captured frame: 0.007576000 seconds" size="0" pos="0" show="0.007576000"/>
    <field name="frame.time_delta_displayed" showname="Time delta from previous displayed frame: 0.024355000 seconds" size="0" pos="0" show="0.024355000"/>
    <field name="frame.time_relative" showname="Time since reference or first frame: 5.566502000 seconds" size="0" pos="0" show="5.566502000"/>
    <field name="frame.number" showname="Frame Number: 1169" size="0" pos="0" show="1169"/>
    <field name="frame.len" showname="Frame Length: 76 bytes (608 bits)" size="0" pos="0" show="76"/>
    <field name="frame.cap_len" showname="Capture Length: 76 bytes (608 bits)" size="0" pos="0" show="76"/>
    <field name="frame.marked" showname="Frame is marked: False" size="0" pos="0" show="0"/>
    <field name="frame.ignored" showname="Frame is ignored: False" size="0" pos="0" show="0"/>
    <field name="frame.protocols" showname="Protocols in frame: sll:ip:tcp:of" size="0" pos="0" show="sll:ip:tcp:of"/>
    <field name="frame.coloring_rule.name" showname="Coloring Rule Name: of" size="0" pos="0" show="of"/>
    <field name="frame.coloring_rule.string" showname="Coloring Rule String: of" size="0" pos="0" show="of"/>
  </proto>
  <proto name="sll" showname="Linux cooked capture" size="16" pos="0">
    <field name="sll.pkttype" showname="Packet type: Unicast to us (0)" size="2" pos="0" show="0" value="0000"/>
    <field name="sll.hatype" showname="Link-layer address type: 772" size="2" pos="2" show="772" value="0304"/>
    <field name="sll.halen" showname="Link-layer address length: 6" size="2" pos="4" show="6" value="0006"/>
    <field name="sll.src.eth" showname="Source: 00:00:00_00:00:00 (00:00:00:00:00:00)" size="6" pos="6" show="00:00:00:00:00:00" value="000000000000"/>
    <field name="sll.etype" showname="Protocol: IP (0x0800)" size="2" pos="14" show="0x0800" value="0800"/>
  </proto>
  <proto name="ip" showname="Internet Protocol Version 4, Src: 127.0.0.1 (127.0.0.1), Dst: 127.0.0.1 (127.0.0.1)" size="20" pos="16">
    <field name="ip.version" showname="Version: 4" size="1" pos="16" show="4" value="45"/>
    <field name="ip.hdr_len" showname="Header length: 20 bytes" size="1" pos="16" show="20" value="45"/>
    <field name="ip.dsfield" showname="Differentiated Services Field: 0x00 (DSCP 0x00: Default; ECN: 0x00: Not-ECT (Not ECN-Capable Transport))" size="1" pos="17" show="0" value="00">
      <field name="ip.dsfield.dscp" showname="0000 00.. = Differentiated Services Codepoint: Default (0x00)" size="1" pos="17" show="0x00" value="0" unmaskedvalue="00"/>
      <field name="ip.dsfield.ecn" showname=".... ..00 = Explicit Congestion Notification: Not-ECT (Not ECN-Capable Transport) (0x00)" size="1" pos="17" show="0x00" value="0" unmaskedvalue="00"/>
    </field>
    <field name="ip.len" showname="Total Length: 60" size="2" pos="18" show="60" value="003c"/>
    <field name="ip.id" showname="Identification: 0x0bd1 (3025)" size="2" pos="20" show="0x0bd1" value="0bd1"/>
    <field name="ip.flags" showname="Flags: 0x02 (Don&apos;t Fragment)" size="1" pos="22" show="0x02" value="40">
      <field name="ip.flags.rb" showname="0... .... = Reserved bit: Not set" size="1" pos="22" show="0" value="40"/>
      <field name="ip.flags.df" showname=".1.. .... = Don&apos;t fragment: Set" size="1" pos="22" show="1" value="40"/>
      <field name="ip.flags.mf" showname="..0. .... = More fragments: Not set" size="1" pos="22" show="0" value="40"/>
    </field>
    <field name="ip.frag_offset" showname="Fragment offset: 0" size="2" pos="22" show="0" value="4000"/>
    <field name="ip.ttl" showname="Time to live: 64" size="1" pos="24" show="64" value="40"/>
    <field name="ip.proto" showname="Protocol: TCP (6)" size="1" pos="25" show="6" value="06"/>
    <field name="ip.checksum" showname="Header checksum: 0x30e9 [correct]" size="2" pos="26" show="0x30e9" value="30e9">
      <field name="ip.checksum_good" showname="Good: True" size="2" pos="26" show="1" value="30e9"/>
      <field name="ip.checksum_bad" showname="Bad: False" size="2" pos="26" show="0" value="30e9"/>
    </field>
    <field name="ip.src" showname="Source: 127.0.0.1 (127.0.0.1)" size="4" pos="28" show="127.0.0.1" value="7f000001"/>
    <field name="ip.addr" showname="Source or Destination Address: 127.0.0.1 (127.0.0.1)" hide="yes" size="4" pos="28" show="127.0.0.1" value="7f000001"/>
    <field name="ip.src_host" showname="Source Host: 127.0.0.1" hide="yes" size="4" pos="28" show="127.0.0.1" value="7f000001"/>
    <field name="ip.host" showname="Source or Destination Host: 127.0.0.1" hide="yes" size="4" pos="28" show="127.0.0.1" value="7f000001"/>
    <field name="ip.dst" showname="Destination: 127.0.0.1 (127.0.0.1)" size="4" pos="32" show="127.0.0.1" value="7f000001"/>
    <field name="ip.addr" showname="Source or Destination Address: 127.0.0.1 (127.0.0.1)" hide="yes" size="4" pos="32" show="127.0.0.1" value="7f000001"/>
    <field name="ip.dst_host" showname="Destination Host: 127.0.0.1" hide="yes" size="4" pos="32" show="127.0.0.1" value="7f000001"/>
    <field name="ip.host" showname="Source or Destination Host: 127.0.0.1" hide="yes" size="4" pos="32" show="127.0.0.1" value="7f000001"/>
  </proto>
  <proto name="tcp" showname="Transmission Control Protocol, Src Port: 6633 (6633), Dst Port: 34809 (34809), Seq: 1, Ack: 9, Len: 8" size="32" pos="36">
    <field name="tcp.srcport" showname="Source port: 6633 (6633)" size="2" pos="36" show="6633" value="19e9"/>
    <field name="tcp.dstport" showname="Destination port: 34809 (34809)" size="2" pos="38" show="34809" value="87f9"/>
    <field name="tcp.port" showname="Source or Destination Port: 6633" hide="yes" size="2" pos="36" show="6633" value="19e9"/>
    <field name="tcp.port" showname="Source or Destination Port: 34809" hide="yes" size="2" pos="38" show="34809" value="87f9"/>
    <field name="tcp.stream" showname="Stream index: 6" size="0" pos="36" show="6"/>
    <field name="tcp.len" showname="TCP Segment Len: 8" hide="yes" size="1" pos="48" show="8" value="80"/>
    <field name="tcp.seq" showname="Sequence number: 1    (relative sequence number)" size="4" pos="40" show="1" value="5543c468"/>
    <field name="tcp.nxtseq" showname="Next sequence number: 9    (relative sequence number)" size="0" pos="36" show="9"/>
    <field name="tcp.ack" showname="Acknowledgement number: 9    (relative ack number)" size="4" pos="44" show="9" value="237b93cc"/>
    <field name="tcp.hdr_len" showname="Header length: 32 bytes" size="1" pos="48" show="32" value="80"/>
    <field name="tcp.flags" showname="Flags: 0x018 (PSH, ACK)" size="2" pos="48" show="0x0018" value="18" unmaskedvalue="8018">
      <field name="tcp.flags.res" showname="000. .... .... = Reserved: Not set" size="1" pos="48" show="0" value="0" unmaskedvalue="80"/>
      <field name="tcp.flags.ns" showname="...0 .... .... = Nonce: Not set" size="1" pos="48" show="0" value="0" unmaskedvalue="80"/>
      <field name="tcp.flags.cwr" showname=".... 0... .... = Congestion Window Reduced (CWR): Not set" size="1" pos="49" show="0" value="0" unmaskedvalue="18"/>
      <field name="tcp.flags.ecn" showname=".... .0.. .... = ECN-Echo: Not set" size="1" pos="49" show="0" value="0" unmaskedvalue="18"/>
      <field name="tcp.flags.urg" showname=".... ..0. .... = Urgent: Not set" size="1" pos="49" show="0" value="0" unmaskedvalue="18"/>
      <field name="tcp.flags.ack" showname=".... ...1 .... = Acknowledgement: Set" size="1" pos="49" show="1" value="1" unmaskedvalue="18"/>
      <field name="tcp.flags.push" showname=".... .... 1... = Push: Set" size="1" pos="49" show="1" value="1" unmaskedvalue="18"/>
      <field name="tcp.flags.reset" showname=".... .... .0.. = Reset: Not set" size="1" pos="49" show="0" value="0" unmaskedvalue="18"/>
      <field name="tcp.flags.syn" showname=".... .... ..0. = Syn: Not set" size="1" pos="49" show="0" value="0" unmaskedvalue="18"/>
      <field name="tcp.flags.fin" showname=".... .... ...0 = Fin: Not set" size="1" pos="49" show="0" value="0" unmaskedvalue="18"/>
    </field>
    <field name="tcp.window_size_value" showname="Window size value: 512" size="2" pos="50" show="512" value="0200"/>
    <field name="tcp.window_size" showname="Calculated window size: 32768" size="2" pos="50" show="32768" value="0200"/>
    <field name="tcp.window_size_scalefactor" showname="Window size scaling factor: 64" size="2" pos="50" show="64" value="0200"/>
    <field name="tcp.checksum" showname="Checksum: 0xfe30 [validation disabled]" size="2" pos="52" show="0xfe30" value="fe30">
      <field name="tcp.checksum_good" showname="Good Checksum: False" size="2" pos="52" show="0" value="fe30"/>
      <field name="tcp.checksum_bad" showname="Bad Checksum: False" size="2" pos="52" show="0" value="fe30"/>
    </field>
    <field name="tcp.options" showname="Options: (12 bytes)" size="12" pos="56" show="01:01:08:0a:00:03:cf:be:00:03:cf:b8" value="0101080a0003cfbe0003cfb8">
      <field name="" show="No-Operation (NOP)" size="1" pos="56" value="01"/>
      <field name="" show="No-Operation (NOP)" size="1" pos="57" value="01"/>
      <field name="" show="Timestamps: TSval 249790, TSecr 249784" size="10" pos="58" value="080a0003cfbe0003cfb8">
        <field name="tcp.option_kind" showname="Kind: Timestamp (8)" size="1" pos="58" show="8" value="08"/>
        <field name="tcp.option_len" showname="Length: 10" size="1" pos="59" show="10" value="0a"/>
        <field name="tcp.options.timestamp.tsval" showname="Timestamp value: 249790" size="4" pos="60" show="249790" value="0003cfbe"/>
        <field name="tcp.options.timestamp.tsecr" showname="Timestamp echo reply: 249784" size="4" pos="64" show="249784" value="0003cfb8"/>
      </field>
    </field>
    <field name="" show="SEQ/ACK analysis" size="0" pos="36" value="">
      <field name="tcp.analysis.bytes_in_flight" showname="Bytes in flight: 8" size="0" pos="36" show="8"/>
    </field>
    <field name="tcp.pdu.size" showname="PDU Size: 8" size="8" pos="68" show="8" value="0100000800000029"/>
  </proto>
  <proto name="of" showname="OpenFlow Protocol" size="8" pos="68">
    <field name="of.header" showname="Header" size="8" pos="68" show="" value="">
      <field name="of.ver" showname="Version: 0x01" size="1" pos="68" show="0x01" value="01"/>
      <field name="of.type" showname="Type: Hello (SM) (0)" size="1" pos="69" show="0" value="00"/>
      <field name="of.len" showname="Length: 8" size="2" pos="70" show="8" value="0008"/>
      <field name="of.id" showname="Transaction ID: 41" size="4" pos="72" show="41" value="00000029"/>
    </field>
  </proto>
</packet>

<packet>
  <proto name="geninfo" pos="0" showname="General information" size="76">
    <field name="num" pos="0" show="1171" showname="Number" value="493" size="76"/>
    <field name="len" pos="0" show="76" showname="Frame Length" value="4c" size="76"/>
    <field name="caplen" pos="0" show="76" showname="Captured Length" value="4c" size="76"/>
    <field name="timestamp" pos="0" show="Dec  9, 2013 13:09:20.447859000 PST" showname="Captured Time" value="1386623360.447859000" size="76"/>
  </proto>
  <proto name="frame" showname="Frame 1171: 76 bytes on wire (608 bits), 76 bytes captured (608 bits)" size="76" pos="0">
    <field name="frame.time" showname="Arrival Time: Dec  9, 2013 13:09:20.447859000 PST" size="0" pos="0" show="Dec  9, 2013 13:09:20.447859000"/>
    <field name="frame.time_epoch" showname="Epoch Time: 1386623360.447859000 seconds" size="0" pos="0" show="1386623360.447859000"/>
    <field name="frame.time_delta" showname="Time delta from previous captured frame: 0.000156000 seconds" size="0" pos="0" show="0.000156000"/>
    <field name="frame.time_delta_displayed" showname="Time delta from previous displayed frame: 0.000184000 seconds" size="0" pos="0" show="0.000184000"/>
    <field name="frame.time_relative" showname="Time since reference or first frame: 5.566686000 seconds" size="0" pos="0" show="5.566686000"/>
    <field name="frame.number" showname="Frame Number: 1171" size="0" pos="0" show="1171"/>
    <field name="frame.len" showname="Frame Length: 76 bytes (608 bits)" size="0" pos="0" show="76"/>
    <field name="frame.cap_len" showname="Capture Length: 76 bytes (608 bits)" size="0" pos="0" show="76"/>
    <field name="frame.marked" showname="Frame is marked: False" size="0" pos="0" show="0"/>
    <field name="frame.ignored" showname="Frame is ignored: False" size="0" pos="0" show="0"/>
    <field name="frame.protocols" showname="Protocols in frame: sll:ip:tcp:of" size="0" pos="0" show="sll:ip:tcp:of"/>
    <field name="frame.coloring_rule.name" showname="Coloring Rule Name: of" size="0" pos="0" show="of"/>
    <field name="frame.coloring_rule.string" showname="Coloring Rule String: of" size="0" pos="0" show="of"/>
  </proto>
  <proto name="sll" showname="Linux cooked capture" size="16" pos="0">
    <field name="sll.pkttype" showname="Packet type: Unicast to us (0)" size="2" pos="0" show="0" value="0000"/>
    <field name="sll.hatype" showname="Link-layer address type: 772" size="2" pos="2" show="772" value="0304"/>
    <field name="sll.halen" showname="Link-layer address length: 6" size="2" pos="4" show="6" value="0006"/>
    <field name="sll.src.eth" showname="Source: 00:00:00_00:00:00 (00:00:00:00:00:00)" size="6" pos="6" show="00:00:00:00:00:00" value="000000000000"/>
    <field name="sll.etype" showname="Protocol: IP (0x0800)" size="2" pos="14" show="0x0800" value="0800"/>
  </proto>
  <proto name="ip" showname="Internet Protocol Version 4, Src: 127.0.0.1 (127.0.0.1), Dst: 127.0.0.1 (127.0.0.1)" size="20" pos="16">
    <field name="ip.version" showname="Version: 4" size="1" pos="16" show="4" value="45"/>
    <field name="ip.hdr_len" showname="Header length: 20 bytes" size="1" pos="16" show="20" value="45"/>
    <field name="ip.dsfield" showname="Differentiated Services Field: 0x00 (DSCP 0x00: Default; ECN: 0x00: Not-ECT (Not ECN-Capable Transport))" size="1" pos="17" show="0" value="00">
      <field name="ip.dsfield.dscp" showname="0000 00.. = Differentiated Services Codepoint: Default (0x00)" size="1" pos="17" show="0x00" value="0" unmaskedvalue="00"/>
      <field name="ip.dsfield.ecn" showname=".... ..00 = Explicit Congestion Notification: Not-ECT (Not ECN-Capable Transport) (0x00)" size="1" pos="17" show="0x00" value="0" unmaskedvalue="00"/>
    </field>
    <field name="ip.len" showname="Total Length: 60" size="2" pos="18" show="60" value="003c"/>
    <field name="ip.id" showname="Identification: 0x0bd2 (3026)" size="2" pos="20" show="0x0bd2" value="0bd2"/>
    <field name="ip.flags" showname="Flags: 0x02 (Don&apos;t Fragment)" size="1" pos="22" show="0x02" value="40">
      <field name="ip.flags.rb" showname="0... .... = Reserved bit: Not set" size="1" pos="22" show="0" value="40"/>
      <field name="ip.flags.df" showname=".1.. .... = Don&apos;t fragment: Set" size="1" pos="22" show="1" value="40"/>
      <field name="ip.flags.mf" showname="..0. .... = More fragments: Not set" size="1" pos="22" show="0" value="40"/>
    </field>
    <field name="ip.frag_offset" showname="Fragment offset: 0" size="2" pos="22" show="0" value="4000"/>
    <field name="ip.ttl" showname="Time to live: 64" size="1" pos="24" show="64" value="40"/>
    <field name="ip.proto" showname="Protocol: TCP (6)" size="1" pos="25" show="6" value="06"/>
    <field name="ip.checksum" showname="Header checksum: 0x30e8 [correct]" size="2" pos="26" show="0x30e8" value="30e8">
