No.     Time        Source                Destination           Protocol Length Info
   1118 5.449699    127.0.0.1             127.0.0.1             OFP      76     Hello (SM) (8B)

Frame 1118: 76 bytes on wire (608 bits), 76 bytes captured (608 bits)
Linux cooked capture
Internet Protocol Version 4, Src: 127.0.0.1 (127.0.0.1), Dst: 127.0.0.1 (127.0.0.1)
Transmission Control Protocol, Src Port: 6633 (6633), Dst Port: 34808 (34808), Seq: 1, Ack: 2, Len: 8
OpenFlow Protocol

No.     Time        Source                Destination           Protocol Length Info
   1162 5.542147    127.0.0.1             127.0.0.1             OFP      76     Hello (SM) (8B)

Frame 1162: 76 bytes on wire (608 bits), 76 bytes captured (608 bits)
Linux cooked capture
Internet Protocol Version 4, Src: 127.0.0.1 (127.0.0.1), Dst: 127.0.0.1 (127.0.0.1)
Transmission Control Protocol, Src Port: 34809 (34809), Dst Port: 6633 (6633), Seq: 1, Ack: 1, Len: 8
OpenFlow Protocol

No.     Time        Source                Destination           Protocol Length Info
   1169 5.566502    127.0.0.1             127.0.0.1             OFP      76     Hello (SM) (8B)


Frame 1169: 76 bytes on wire (608 bits), 76 bytes captured (608 bits)
Linux cooked capture
Internet Protocol Version 4, Src: 127.0.0.1 (127.0.0.1), Dst: 127.0.0.1 (127.0.0.1)
Transmission Control Protocol, Src Port: 6633 (6633), Dst Port: 34809 (34809), Seq: 1, Ack: 9, Len: 8
OpenFlow Protocol

No.     Time        Source                Destination           Protocol Length Info
   1171 5.566686    127.0.0.1             127.0.0.1             OFP      76     Features Request (CSM) (8B)

Frame 1171: 76 bytes on wire (608 bits), 76 bytes captured (608 bits)
Linux cooked capture
Internet Protocol Version 4, Src: 127.0.0.1 (127.0.0.1), Dst: 127.0.0.1 (127.0.0.1)
Transmission Control Protocol, Src Port: 6633 (6633), Dst Port: 34809 (34809), Seq: 9, Ack: 9, Len: 8
OpenFlow Protocol

No.     Time        Source                Destination           Protocol Length Info
   1173 5.566888    127.0.0.1             127.0.0.1             OFP      244    Features Reply (CSM) (176B)

Frame 1173: 244 bytes on wire (1952 bits), 244 bytes captured (1952 bits)
Linux cooked capture
Internet Protocol Version 4, Src: 127.0.0.1 (127.0.0.1), Dst: 127.0.0.1 (127.0.0.1)
Transmission Control Protocol, Src Port: 34809 (34809), Dst Port: 6633 (6633), Seq: 9, Ack: 17, Len: 176
OpenFlow Protocol

No.     Time        Source                Destination           Protocol Length Info
   1174 5.568146    127.0.0.1             127.0.0.1             OFP      80     Set Config (CSM) (12B)

Frame 1174: 80 bytes on wire (640 bits), 80 bytes captured (640 bits)
Linux cooked capture
Internet Protocol Version 4, Src: 127.0.0.1 (127.0.0.1), Dst: 127.0.0.1 (127.0.0.1)
Transmission Control Protocol, Src Port: 6633 (6633), Dst Port: 34809 (34809), Seq: 17, Ack: 185, Len: 12
OpenFlow Protocol

No.     Time        Source                Destination           Protocol Length Info
   1176 5.589595    ::                    ff02::1:ff15:91d3     OFP+ICMPv6 164    Packet In (AM) (BufID=256) (96B) => Neighbor Solicitation for fe80::9c86:b0ff:fe15:91d3

Frame 1176: 164 bytes on wire (1312 bits), 164 bytes captured (1312 bits)
Linux cooked capture
Internet Protocol Version 4, Src: 127.0.0.1 (127.0.0.1), Dst: 127.0.0.1 (127.0.0.1)
Transmission Control Protocol, Src Port: 34809 (34809), Dst Port: 6633 (6633), Seq: 185, Ack: 29, Len: 96
OpenFlow Protocol

No.     Time        Source                Destination           Protocol Length Info
   1177 5.589626    127.0.0.1             127.0.0.1             OFP      148    Barrier Request (CSM) (8B)

Frame 1177: 148 bytes on wire (1184 bits), 148 bytes captured (1184 bits)
Linux cooked capture
Internet Protocol Version 4, Src: 127.0.0.1 (127.0.0.1), Dst: 127.0.0.1 (127.0.0.1)
Transmission Control Protocol, Src Port: 6633 (6633), Dst Port: 34809 (34809), Seq: 29, Ack: 281, Len: 80
OpenFlow Protocol
OpenFlow Protocol

No.     Time        Source                Destination           Protocol Length Info
   1178 5.589803    127.0.0.1             127.0.0.1             OFP      76     Barrier Reply (CSM) (8B)

Frame 1178: 76 bytes on wire (608 bits), 76 bytes captured (608 bits)
Linux cooked capture
Internet Protocol Version 4, Src: 127.0.0.1 (127.0.0.1), Dst: 127.0.0.1 (127.0.0.1)
Transmission Control Protocol, Src Port: 34809 (34809), Dst Port: 6633 (6633), Seq: 281, Ack: 109, Len: 8
OpenFlow Protocol

No.     Time        Source                Destination           Protocol Length Info
   1319 6.097468    ::                    ff02::1:ff9e:d15d     OFP+ICMPv6 164    Packet In (AM) (BufID=257) (96B) => Neighbor Solicitation for fe80::4c0c:38ff:fe9e:d15d

Frame 1319: 164 bytes on wire (1312 bits), 164 bytes captured (1312 bits)
Linux cooked capture
Internet Protocol Version 4, Src: 127.0.0.1 (127.0.0.1), Dst: 127.0.0.1 (127.0.0.1)
Transmission Control Protocol, Src Port: 34809 (34809), Dst Port: 6633 (6633), Seq: 289, Ack: 109, Len: 96
OpenFlow Protocol

No.     Time        Source                Destination           Protocol Length Info
   1321 6.123115    127.0.0.1             127.0.0.1             OFP      92     Packet Out (CSM) (BufID=257) (24B)

Frame 1321: 92 bytes on wire (736 bits), 92 bytes captured (736 bits)
Linux cooked capture
Internet Protocol Version 4, Src: 127.0.0.1 (127.0.0.1), Dst: 127.0.0.1 (127.0.0.1)
Transmission Control Protocol, Src Port: 6633 (6633), Dst Port: 34809 (34809), Seq: 109, Ack: 385, Len: 24
OpenFlow Protocol

No.     Time        Source                Destination           Protocol Length Info
   1339 6.482493    127.0.0.1             127.0.0.1             OFP      132    Port Status (AM) (64B)

Frame 1339: 132 bytes on wire (1056 bits), 132 bytes captured (1056 bits)
Linux cooked capture
Internet Protocol Version 4, Src: 127.0.0.1 (127.0.0.1), Dst: 127.0.0.1 (127.0.0.1)
Transmission Control Protocol, Src Port: 34809 (34809), Dst Port: 6633 (6633), Seq: 385, Ack: 133, Len: 64
OpenFlow Protocol

No.     Time        Source                Destination           Protocol Length Info
   1343 6.590001    fe80::9c86:b0ff:fe15:91d3 ff02::2               OFP+ICMPv6 156    Packet In (AM) (BufID=258) (88B) => Router Solicitation from 9e:86:b0:15:91:d3

Frame 1343: 156 bytes on wire (1248 bits), 156 bytes captured (1248 bits)
Linux cooked capture
Internet Protocol Version 4, Src: 127.0.0.1 (127.0.0.1), Dst: 127.0.0.1 (127.0.0.1)
Transmission Control Protocol, Src Port: 34809 (34809), Dst Port: 6633 (6633), Seq: 449, Ack: 133, Len: 88
OpenFlow Protocol

No.     Time        Source                Destination           Protocol Length Info
   1347 6.613297    127.0.0.1             127.0.0.1             OFP      92     Packet Out (CSM) (BufID=258) (24B)

Frame 1347: 92 bytes on wire (736 bits), 92 bytes captured (736 bits)
Linux cooked capture
Internet Protocol Version 4, Src: 127.0.0.1 (127.0.0.1), Dst: 127.0.0.1 (127.0.0.1)
Transmission Control Protocol, Src Port: 6633 (6633), Dst Port: 34809 (34809), Seq: 133, Ack: 537, Len: 24
OpenFlow Protocol

No.     Time        Source                Destination           Protocol Length Info
   1358 7.097487    fe80::4c0c:38ff:fe9e:d15d ff02::2               OFP+ICMPv6 156    Packet In (AM) (BufID=259) (88B) => Router Solicitation from 4e:0c:38:9e:d1:5d

Frame 1358: 156 bytes on wire (1248 bits), 156 bytes captured (1248 bits)
Linux cooked capture
Internet Protocol Version 4, Src: 127.0.0.1 (127.0.0.1), Dst: 127.0.0.1 (127.0.0.1)
Transmission Control Protocol, Src Port: 34809 (34809), Dst Port: 6633 (6633), Seq: 537, Ack: 157, Len: 88
OpenFlow Protocol

No.     Time        Source                Destination           Protocol Length Info
   1372 7.135256    127.0.0.1             127.0.0.1             OFP      92     Packet Out (CSM) (BufID=259) (24B)

Frame 1372: 92 bytes on wire (736 bits), 92 bytes captured (736 bits)
Linux cooked capture
Internet Protocol Version 4, Src: 127.0.0.1 (127.0.0.1), Dst: 127.0.0.1 (127.0.0.1)
Transmission Control Protocol, Src Port: 6633 (6633), Dst Port: 34809 (34809), Seq: 157, Ack: 625, Len: 24
OpenFlow Protocol

No.     Time        Source                Destination           Protocol Length Info
   1429 10.597467   fe80::9c86:b0ff:fe15:91d3 ff02::2               OFP+ICMPv6 156    Packet In (AM) (BufID=260) (88B) => Router Solicitation from 9e:86:b0:15:91:d3

Frame 1429: 156 bytes on wire (1248 bits), 156 bytes captured (1248 bits)
Linux cooked capture
Internet Protocol Version 4, Src: 127.0.0.1 (127.0.0.1), Dst: 127.0.0.1 (127.0.0.1)
Transmission Control Protocol, Src Port: 34809 (34809), Dst Port: 6633 (6633), Seq: 625, Ack: 181, Len: 88
OpenFlow Protocol

No.     Time        Source                Destination           Protocol Length Info
   1430 10.620047   127.0.0.1             127.0.0.1             OFP      92     Packet Out (CSM) (BufID=260) (24B)

Frame 1430: 92 bytes on wire (736 bits), 92 bytes captured (736 bits)
Linux cooked capture
Internet Protocol Version 4, Src: 127.0.0.1 (127.0.0.1), Dst: 127.0.0.1 (127.0.0.1)
Transmission Control Protocol, Src Port: 6633 (6633), Dst Port: 34809 (34809), Seq: 181, Ack: 713, Len: 24
OpenFlow Protocol

No.     Time        Source                Destination           Protocol Length Info
   1448 11.110368   fe80::4c0c:38ff:fe9e:d15d ff02::2               OFP+ICMPv6 156    Packet In (AM) (BufID=261) (88B) => Router Solicitation from 4e:0c:38:9e:d1:5d

Frame 1448: 156 bytes on wire (1248 bits), 156 bytes captured (1248 bits)
Linux cooked capture
Internet Protocol Version 4, Src: 127.0.0.1 (127.0.0.1), Dst: 127.0.0.1 (127.0.0.1)
Transmission Control Protocol, Src Port: 34809 (34809), Dst Port: 6633 (6633), Seq: 713, Ack: 205, Len: 88
OpenFlow Protocol

No.     Time        Source                Destination           Protocol Length Info
   1460 11.142754   127.0.0.1             127.0.0.1             OFP      92     Packet Out (CSM) (BufID=261) (24B)

Frame 1460: 92 bytes on wire (736 bits), 92 bytes captured (736 bits)
Linux cooked capture
Internet Protocol Version 4, Src: 127.0.0.1 (127.0.0.1), Dst: 127.0.0.1 (127.0.0.1)
Transmission Control Protocol, Src Port: 6633 (6633), Dst Port: 34809 (34809), Seq: 205, Ack: 801, Len: 24
OpenFlow Protocol

No.     Time        Source                Destination           Protocol Length Info
   1465 11.222793   fe80::4c0c:38ff:fe9e:d15d ff02::16              OFP+ICMPv6 176    Packet In (AM) (BufID=262) (108B) => Multicast Listener Report Message v2

Frame 1465: 176 bytes on wire (1408 bits), 176 bytes captured (1408 bits)
Linux cooked capture
Internet Protocol Version 4, Src: 127.0.0.1 (127.0.0.1), Dst: 127.0.0.1 (127.0.0.1)
Transmission Control Protocol, Src Port: 34809 (34809), Dst Port: 6633 (6633), Seq: 801, Ack: 229, Len: 108
OpenFlow Protocol

No.     Time        Source                Destination           Protocol Length Info
   1467 11.258832   127.0.0.1             127.0.0.1             OFP      92     Packet Out (CSM) (BufID=262) (24B)

Frame 1467: 92 bytes on wire (736 bits), 92 bytes captured (736 bits)
Linux cooked capture
Internet Protocol Version 4, Src: 127.0.0.1 (127.0.0.1), Dst: 127.0.0.1 (127.0.0.1)
Transmission Control Protocol, Src Port: 6633 (6633), Dst Port: 34809 (34809), Seq: 229, Ack: 909, Len: 24
OpenFlow Protocol

No.     Time        Source                Destination           Protocol Length Info
   1529 14.605498   fe80::9c86:b0ff:fe15:91d3 ff02::2               OFP+ICMPv6 156    Packet In (AM) (BufID=263) (88B) => Router Solicitation from 9e:86:b0:15:91:d3

Frame 1529: 156 bytes on wire (1248 bits), 156 bytes captured (1248 bits)
Linux cooked capture
Internet Protocol Version 4, Src: 127.0.0.1 (127.0.0.1), Dst: 127.0.0.1 (127.0.0.1)
Transmission Control Protocol, Src Port: 34809 (34809), Dst Port: 6633 (6633), Seq: 909, Ack: 253, Len: 88
OpenFlow Protocol

No.     Time        Source                Destination           Protocol Length Info
   1530 14.642635   127.0.0.1             127.0.0.1             OFP      92     Packet Out (CSM) (BufID=263) (24B)

Frame 1530: 92 bytes on wire (736 bits), 92 bytes captured (736 bits)
Linux cooked capture
Internet Protocol Version 4, Src: 127.0.0.1 (127.0.0.1), Dst: 127.0.0.1 (127.0.0.1)
Transmission Control Protocol, Src Port: 6633 (6633), Dst Port: 34809 (34809), Seq: 253, Ack: 997, Len: 24
OpenFlow Protocol

No.     Time        Source                Destination           Protocol Length Info
   1803 15.118340   fe80::4c0c:38ff:fe9e:d15d ff02::2               OFP+ICMPv6 156    Packet In (AM) (BufID=264) (88B) => Router Solicitation from 4e:0c:38:9e:d1:5d

Frame 1803: 156 bytes on wire (1248 bits), 156 bytes captured (1248 bits)
Linux cooked capture
Internet Protocol Version 4, Src: 127.0.0.1 (127.0.0.1), Dst: 127.0.0.1 (127.0.0.1)
Transmission Control Protocol, Src Port: 34809 (34809), Dst Port: 6633 (6633), Seq: 997, Ack: 277, Len: 88
OpenFlow Protocol

No.     Time        Source                Destination           Protocol Length Info
   1814 15.163209   127.0.0.1             127.0.0.1             OFP      92     Packet Out (CSM) (BufID=264) (24B)

Frame 1814: 92 bytes on wire (736 bits), 92 bytes captured (736 bits)
Linux cooked capture
Internet Protocol Version 4, Src: 127.0.0.1 (127.0.0.1), Dst: 127.0.0.1 (127.0.0.1)
Transmission Control Protocol, Src Port: 6633 (6633), Dst Port: 34809 (34809), Seq: 277, Ack: 1085, Len: 24
OpenFlow Protocol

No.     Time        Source                Destination           Protocol Length Info
   1820 15.269466   fe80::9c86:b0ff:fe15:91d3 ff02::16              OFP+ICMPv6 176    Packet In (AM) (BufID=265) (108B) => Multicast Listener Report Message v2

Frame 1820: 176 bytes on wire (1408 bits), 176 bytes captured (1408 bits)
Linux cooked capture
Internet Protocol Version 4, Src: 127.0.0.1 (127.0.0.1), Dst: 127.0.0.1 (127.0.0.1)
Transmission Control Protocol, Src Port: 34809 (34809), Dst Port: 6633 (6633), Seq: 1085, Ack: 301, Len: 108
OpenFlow Protocol

No.     Time        Source                Destination           Protocol Length Info
   1822 15.279035   127.0.0.1             127.0.0.1             OFP      92     Packet Out (CSM) (BufID=265) (24B)

Frame 1822: 92 bytes on wire (736 bits), 92 bytes captured (736 bits)
Linux cooked capture
Internet Protocol Version 4, Src: 127.0.0.1 (127.0.0.1), Dst: 127.0.0.1 (127.0.0.1)
Transmission Control Protocol, Src Port: 6633 (6633), Dst Port: 34809 (34809), Seq: 301, Ack: 1193, Len: 24
OpenFlow Protocol

No.     Time        Source                Destination           Protocol Length Info
   1986 19.406564   127.0.0.1             127.0.0.1             OFP      76     Echo Request (SM) (8B)

Frame 1986: 76 bytes on wire (608 bits), 76 bytes captured (608 bits)
Linux cooked capture
Internet Protocol Version 4, Src: 127.0.0.1 (127.0.0.1), Dst: 127.0.0.1 (127.0.0.1)
Transmission Control Protocol, Src Port: 34809 (34809), Dst Port: 6633 (6633), Seq: 1193, Ack: 325, Len: 8
OpenFlow Protocol

No.     Time        Source                Destination           Protocol Length Info
   1988 19.447337   127.0.0.1             127.0.0.1             OFP      76     Echo Reply (SM) (8B)

Frame 1988: 76 bytes on wire (608 bits), 76 bytes captured (608 bits)
Linux cooked capture
Internet Protocol Version 4, Src: 127.0.0.1 (127.0.0.1), Dst: 127.0.0.1 (127.0.0.1)
Transmission Control Protocol, Src Port: 6633 (6633), Dst Port: 34809 (34809), Seq: 325, Ack: 1201, Len: 8
OpenFlow Protocol

No.     Time        Source                Destination           Protocol Length Info
   2081 24.406739   127.0.0.1             127.0.0.1             OFP      76     Echo Request (SM) (8B)

Frame 2081: 76 bytes on wire (608 bits), 76 bytes captured (608 bits)
Linux cooked capture
Internet Protocol Version 4, Src: 127.0.0.1 (127.0.0.1), Dst: 127.0.0.1 (127.0.0.1)
Transmission Control Protocol, Src Port: 34809 (34809), Dst Port: 6633 (6633), Seq: 1201, Ack: 333, Len: 8
OpenFlow Protocol

No.     Time        Source                Destination           Protocol Length Info
   2083 24.428205   127.0.0.1             127.0.0.1             OFP      76     Echo Reply (SM) (8B)

Frame 2083: 76 bytes on wire (608 bits), 76 bytes captured (608 bits)
Linux cooked capture
Internet Protocol Version 4, Src: 127.0.0.1 (127.0.0.1), Dst: 127.0.0.1 (127.0.0.1)
Transmission Control Protocol, Src Port: 6633 (6633), Dst Port: 34809 (34809), Seq: 333, Ack: 1209, Len: 8
OpenFlow Protocol

No.     Time        Source                Destination           Protocol Length Info
   2295 29.406708   127.0.0.1             127.0.0.1             OFP      76     Echo Request (SM) (8B)

Frame 2295: 76 bytes on wire (608 bits), 76 bytes captured (608 bits)
Linux cooked capture
Internet Protocol Version 4, Src: 127.0.0.1 (127.0.0.1), Dst: 127.0.0.1 (127.0.0.1)
Transmission Control Protocol, Src Port: 34809 (34809), Dst Port: 6633 (6633), Seq: 1209, Ack: 341, Len: 8
OpenFlow Protocol

No.     Time        Source                Destination           Protocol Length Info
   2297 29.455774   127.0.0.1             127.0.0.1             OFP      76     Echo Reply (SM) (8B)

Frame 2297: 76 bytes on wire (608 bits), 76 bytes captured (608 bits)
Linux cooked capture
Internet Protocol Version 4, Src: 127.0.0.1 (127.0.0.1), Dst: 127.0.0.1 (127.0.0.1)
Transmission Control Protocol, Src Port: 6633 (6633), Dst Port: 34809 (34809), Seq: 341, Ack: 1217, Len: 8
OpenFlow Protocol

No.     Time        Source                Destination           Protocol Length Info
   2364 32.093587   127.0.0.1             127.0.0.1             OFP      132    Port Status (AM) (64B)

Frame 2364: 132 bytes on wire (1056 bits), 132 bytes captured (1056 bits)
Linux cooked capture
Internet Protocol Version 4, Src: 127.0.0.1 (127.0.0.1), Dst: 127.0.0.1 (127.0.0.1)
Transmission Control Protocol, Src Port: 34809 (34809), Dst Port: 6633 (6633), Seq: 1217, Ack: 349, Len: 64
OpenFlow Protocol

No.     Time        Source                Destination           Protocol Length Info
   2366 32.093623   127.0.0.1             127.0.0.1             OFP      132    Port Status (AM) (64B)

Frame 2366: 132 bytes on wire (1056 bits), 132 bytes captured (1056 bits)
Linux cooked capture
Internet Protocol Version 4, Src: 127.0.0.1 (127.0.0.1), Dst: 127.0.0.1 (127.0.0.1)
Transmission Control Protocol, Src Port: 34809 (34809), Dst Port: 6633 (6633), Seq: 1281, Ack: 349, Len: 64
OpenFlow Protocol
